date,ticker,headline,polarity,subjectivity,sentiment
2022-10-27 00:00:00,AAPL,2 Cryptocurrencies That Are Down More Than 70% and Ready to Pop,0.1814814814814815,0.42962962962962964,positive
2022-10-27 00:00:00,AAPL,"US STOCKS-Dow jumps on earnings boost, Meta drags Nasdaq lower",1.0,0.2,positive
2022-10-26 00:00:00,AAPL,US STOCKS-Nasdaq falls as weak Big Tech earnings fan growth concerns; Visa buoys Dow,-0.5,0.4,negative
2022-10-26 00:00:00,AAPL,SONY Gears Up to Report Q2 Earnings: Here's What to Expect,0.0,0.0,neutral
2022-10-26 00:00:00,AAPL,"US STOCKS-S&P, Nasdaq pulled lower as tech earnings misses fuel slowdown fears",-1.0,0.1,negative
2022-10-26 00:00:00,AAPL,"US STOCKS-S&P 500 ends lower, snapping rally on mounting slowdown fears",1.0,0.1,positive
2022-10-26 00:00:00,AAPL,"US STOCKS-S&P 500 ends lower, snapping rally on mounting slowdown fears",1.0,0.1,positive
2022-10-26 00:00:00,AAPL,Meta Platforms beats estimates for quarterly revenue,1.0,0.1,positive
2022-10-26 00:00:00,AAPL,"After Hours Most Active for Oct 26, 2022 : META, SNAP, TQQQ, AAPL, QQQ, WFC, F, SQQQ, RTO, BP, FDX, AMZN",0.18333333333333335,0.55,positive
2022-10-26 00:00:00,AAPL,Will iPhone Revenue Boost Apple (AAPL) Stock?,1.0,0.1,positive
2022-10-26 00:00:00,AAPL,"IVV, AAPL, MSFT, GOOG: Large Inflows Detected at ETF",0.21428571428571427,0.42857142857142855,positive
2022-10-26 00:00:00,AAPL,Meta Platforms beats estimates for quarterly revenue,1.0,0.1,positive
2022-10-26 00:00:00,AAPL,Big Tech tumbles as results set off alarm bells,-1.0,0.1,negative
2022-10-26 00:00:00,AAPL,"PREVIEW-Apple's holiday quarter may face pressure from inflation, weak China demand",-1.0,0.1,negative
2022-10-26 00:00:00,AAPL,Should Franklin U.S. Large Cap Multifactor Index ETF (FLQL) Be on Your Investing Radar?,0.21428571428571427,0.42857142857142855,positive
2022-10-26 00:00:00,AAPL,Will Slowing Services Growth Hurt Apple's (AAPL) Q4 Earnings?,1.0,0.2,positive
2022-10-26 00:00:00,AAPL,Is iShares U.S. Equity Factor ETF (LRGF) a Strong ETF Right Now?,1.0,0.1,positive
2022-10-26 00:00:00,AAPL,Target Expands Collaboration With Apple To Triple Apple At Target Locations,0.0,0.0,neutral
2022-10-26 00:00:00,AAPL,Can Higher Revenues Aid Monolithic Power (MPWR) Q3 Earnings?,1.0,0.1,positive
2022-10-26 00:00:00,AAPL,US STOCKS-Nasdaq futures fall 1% as tech earnings spark slowdown fears,-1.0,0.1,negative
2022-10-26 00:00:00,AAPL,Should John Hancock Multifactor Large Cap ETF (JHML) Be on Your Investing Radar?,0.21428571428571427,0.42857142857142855,positive
2022-10-26 00:00:00,AAPL,LG Display posts bigger-than-expected Q3 loss on sluggish device sales,-1.0,0.1,negative
2022-10-26 00:00:00,AAPL,Big Tech tumbles as results sound alarm bells,-1.0,0.1,negative
2022-10-26 00:00:00,AAPL,US STOCKS-Nasdaq futures drop over 1% as weak tech earnings fan slowdown fears,-1.0,0.2,negative
2022-10-26 00:00:00,AAPL,"Apple’s (NASDAQ:AAPL) Q4 Preview: Revenues to Hit Estimates, Says Analyst",0.0,0.0,neutral
2022-10-26 00:00:00,AAPL,Is a Surprise Coming for Apple (AAPL) This Earnings Season?,1.0,0.1,positive
2022-10-25 00:00:00,AAPL,Why Is Everyone Talking About Apple?,0.0,0.0,neutral
2022-10-25 00:00:00,AAPL,Don't Overlook Service Revenues in Apple's Q4,0.0,0.0,neutral
2022-10-25 00:00:00,AAPL,Poor report cards at U.S. companies fan recession fears,-0.4,0.6,negative
2022-10-25 00:00:00,AAPL,Top 10 Wide-Moat Stocks to Buy Now,0.5,0.5,positive
2022-10-25 00:00:00,AAPL,Will Lower Ad Revenues Hurt Meta Platforms (META) Q3 Earnings?,0.0,0.0,neutral
2022-10-25 00:00:00,AAPL,US STOCKS-Nasdaq leads Wall St higher on hopes of less-hawkish Federal Reserve,1.0,0.1,positive
2022-10-25 00:00:00,AAPL,Apple's iPhone Revenue Set to Be Key in Q4 Earnings,0.0,1.0,neutral
2022-10-25 00:00:00,AAPL,US STOCKS-Nasdaq leads Wall Street higher as investors brace for megacap earnings,1.0,0.1,positive
2022-10-25 00:00:00,AAPL,Will Top-Line Contraction Dent Intel (INTC) Q3 Earnings?,0.0,0.0,neutral
2022-10-25 00:00:00,AAPL,"ESGU, KALL: Big ETF Outflows",0.0,0.1,neutral
2022-10-25 00:00:00,AAPL,Will Higher Revenues Benefit T-Mobile (TMUS) Q3 Earnings?,1.0,0.1,positive
2022-10-25 00:00:00,AAPL,Why Earnings from General Motors (GM) and Coca-Cola (KO) Have Changed the Overall Outlook for Stocks,0.02500000000000001,0.25,neutral
2022-10-25 00:00:00,AAPL,What's in Store for Western Digital (WDC) in Q1 Earnings?,0.0,0.0,neutral
2022-10-25 00:00:00,AAPL,"This Growth Stock Is Down 90%, but Is It a Buy Now?",1.0,0.1,positive
2022-10-25 00:00:00,AAPL,US STOCKS-Nasdaq leads Wall Street higher as investors brace for megacap earnings,1.0,0.1,positive
2022-10-25 00:00:00,AAPL,"The Zacks Analyst Blog Highlights Apple, Netflix, Disney and Amazon",1.0,0.1,positive
2022-10-25 00:00:00,AAPL,Apple Q4 Preview: Another EPS Beat Inbound?,1.0,0.1,positive
2022-10-25 00:00:00,AAPL,European stocks rise as earnings offset economic gloom,1.0,0.1,positive
2022-10-25 00:00:00,AAPL,"The Zacks Analyst Blog Highlights Microsoft, Alphabet, Apple and Amazon.",1.0,0.1,positive
2022-10-25 00:00:00,AAPL,Is Snap Stock a Buy Now?,0.0,0.0,neutral
2022-10-25 00:00:00,AAPL,"Pre-Market Most Active for Oct 25, 2022 : TQQQ, TSHA, SQQQ, CSX, PINS, EBAY, AAPL, NIO, M, BABA, SNAP, GM",0.18333333333333335,0.55,positive
2022-10-25 00:00:00,AAPL,Apple is cutting back production of iPhone 14 Plus due to weak demand - TrendForce,-1.0,0.1,negative
2022-10-25 00:00:00,AAPL,"Solana Might Be Down 85%, But It Has a Jaw-Dropping Strategy to Bounce Back in 2023",-1.0,0.1,negative
2022-10-25 00:00:00,AAPL,"Apple announces new clean energy investments, asks suppliers to decarbonize",0.2515151515151515,0.5772727272727273,positive
2022-10-25 00:00:00,AAPL,Is Franklin U.S. Large Cap Multifactor Index ETF (FLQL) a Strong ETF Right Now?,1.0,0.1,positive
2022-10-25 00:00:00,AAPL,GLOBAL MARKETS-Asia stocks struggle as Xi's leadership team spooks markets,0.0,0.0,neutral
2022-10-25 00:00:00,AAPL,Is WisdomTree U.S. LargeCap ETF (EPS) a Strong ETF Right Now?,1.0,0.1,positive
2022-10-25 00:00:00,AAPL,"Stock Market News for Oct 25, 2022",0.0,0.0,neutral
2022-10-25 00:00:00,AAPL,Nasdaq Bear Market: 2 Warren Buffett Stocks to Buy Hand Over Fist,0.0,0.0,neutral
2022-10-25 00:00:00,AAPL,Adidas plans to end Kanye West partnership over 'offensive behaviour' - Bloomberg News,0.0,0.0,neutral
2022-10-25 00:00:00,AAPL,Apple is cutting back production of iPhone 14 Plus due to weak demand - TrendForce,-1.0,0.1,negative
2022-10-24 00:00:00,AAPL,"Alphabet, Microsoft, Meta Platforms, Apple and Amazon are part of Zacks Earnings Preview",0.0,0.0,neutral
2022-10-24 00:00:00,AAPL,Big-Tech Earnings Week Commences,0.0,0.0,neutral
2022-10-24 00:00:00,AAPL,"GLOBAL MARKETS-Asian stocks ease to 2-1/2-year lows, pound lifted by Sunak's victory",0.0,0.0,neutral
2022-10-24 00:00:00,AAPL,"Markets Up Big from a Month Ago, Earnings On Deck",0.0,0.1,neutral
2022-10-24 00:00:00,AAPL,"GLOBAL MARKETS-U.S., European shares climb on hopes Fed will slow rate hike pace",-0.10000000000000002,0.13333333333333333,negative
2022-10-24 00:00:00,AAPL,US STOCKS-Wall St closes sharply higher on hopes of abating Fed,1.0,0.1,positive
2022-10-24 00:00:00,AAPL,"After Hours Most Active for Oct 24, 2022 : PFE, PM, IXUS, QQQ, AIV, CSCO, ESTC, SNAP, BSX, AAPL, INTC, AMZN",0.18333333333333335,0.55,positive
2022-10-24 00:00:00,AAPL,Stocks Extend Rally Ahead of Big Tech Earnings,1.0,0.1,positive
2022-10-24 00:00:00,AAPL,US STOCKS-Wall St closes up on hopes of abating Fed,0.0,0.0,neutral
2022-10-24 00:00:00,AAPL,US STOCKS-Wall St rises as data hints at Fed policy progress,1.0,0.1,positive
2022-10-24 00:00:00,AAPL,Microsoft powers up search for Chinese gaming hits in race against Sony,1.0,0.1,positive
2022-10-24 00:00:00,AAPL,US STOCKS-Wall Street mixed after weak business data; Tesla drags Nasdaq,-1.0,0.1,negative
2022-10-24 00:00:00,AAPL,Is iShares MSCI ACWI Low Carbon Target ETF (CRBN) a Strong ETF Right Now?,1.0,0.1,positive
2022-10-24 00:00:00,AAPL,Apple (AAPL) to Report Q4 Earnings: What's in the Offing?,0.0,0.0,neutral
2022-10-24 00:00:00,AAPL,US STOCKS-Wall Street set to open higher as bond yields retreat,1.0,0.1,positive
2022-10-24 00:00:00,AAPL,US STOCKS-Futures reverse losses as bond yields retreat,-1.0,0.1,negative
2022-10-24 00:00:00,AAPL,Will Higher Revenues Benefit Corning (GLW) Q3 Earnings?,1.0,0.1,positive
2022-10-24 00:00:00,AAPL,Can Top-Line Improvement Aid Juniper (JNPR) Q3 Earnings?,0.0,0.0,neutral
2022-10-24 00:00:00,AAPL,GLOBAL MARKETS-Dollar shakes off suspected Japan intervention; stocks brace for earnings,0.0,0.0,neutral
2022-10-24 00:00:00,AAPL,US STOCKS-Futures slide as China worries sour global mood,-0.07500000000000001,0.049999999999999996,neutral
2022-10-24 00:00:00,AAPL,"GLOBAL MARKETS-Dollar shrugs off suspected yen intervention, Europe clings to Fed hopes",0.0,0.0,neutral
2022-10-24 00:00:00,AAPL,GLOBAL MARKETS-Dollar shakes off suspected Japan intervention; stocks brace for earnings,0.0,0.0,neutral
2022-10-24 00:00:00,AAPL,Wolfspeed (WOLF) to Report Q1 Earnings: What's in the Cards?,0.0,0.0,neutral
2022-10-23 00:00:00,AAPL,Wall St Week Ahead-Megacap earnings to test fledgling U.S. stock rebound,0.0,0.0,neutral
2022-10-23 00:00:00,AAPL,"GLOBAL MARKETS-Dollar weathers suspected yen intervention, China data mixed",0.0,0.125,neutral
2022-10-23 00:00:00,AAPL,"GLOBAL MARKETS-Dollar see saws on suspected yen intervention, shares rally",1.0,0.1,positive
2022-10-23 00:00:00,AAPL,"Weekly Preview: Earnings To Watch (AAPL, AMZN, GOOG, META, MSFT) - Week of October 23",0.0,0.0,neutral
2022-10-23 00:00:00,AAPL,Snap's Stock Crashes as Apple's Policy Changes Crimp Advertiser Demand,-1.0,0.1,negative
2022-10-22 00:00:00,AAPL,Dividend Stocks That Do More Than Just Boost Their Payout,1.0,0.1,positive
2022-10-22 00:00:00,AAPL,This Dow Jones Stock Is a No-Brainer for Dividend Growth,1.0,0.1,positive
2022-10-21 00:00:00,AAPL,Why Snap Stock Got Crushed Early Friday,0.0,0.2,neutral
2022-10-21 00:00:00,AAPL,First Leg of Earnings Season Going Better Than Expected,0.21666666666666667,0.41111111111111115,positive
2022-10-21 00:00:00,AAPL,US STOCKS-Wall Street ends higher as hopes for less aggressive Fed grow,1.0,0.1,positive
2022-10-21 00:00:00,AAPL,US STOCKS-Wall Street ends higher as hopes for less aggressive Fed grow,1.0,0.1,positive
2022-10-21 00:00:00,AAPL,US STOCKS-Wall Street rallies on hopes of less aggressive Fed,-0.16666666666666666,0.06666666666666667,negative
2022-10-21 00:00:00,AAPL,Here's What to Expect from Big Tech Earnings,0.0,0.1,neutral
2022-10-21 00:00:00,AAPL,"Notable Friday Option Activity: ORCL, COST, AAPL",0.5,0.5,positive
2022-10-21 00:00:00,AAPL,Wall St Week Ahead-Megacap earnings to test fledgling U.S. stock rebound,0.0,0.0,neutral
2022-10-21 00:00:00,AAPL,Apple's industrial design head Hankey to leave - Bloomberg News,0.0,0.0,neutral
2022-10-21 00:00:00,AAPL,"PDBC, DYNF: Big ETF Outflows",0.0,0.1,neutral
2022-10-21 00:00:00,AAPL,What Lies Ahead for Big Tech ETFs in Q3 Earnings?,0.0,0.1,neutral
2022-10-21 00:00:00,AAPL,"Q3 Earnings Decent So Far; Big Tech Next: AAPL, MSFT, GOOGL, etc.",0.06666666666666667,0.44166666666666665,neutral
2022-10-21 00:00:00,AAPL,Amphenol (APH) to Report Q3 Earnings: What's in the Cards?,0.0,0.0,neutral
2022-10-21 00:00:00,AAPL,Meta Platforms (META) to Report Q3 Earnings: What to Expect,0.0,0.0,neutral
2022-10-21 00:00:00,AAPL,Burned by Tech Stocks? Try These 3 ETFs Instead,0.0,0.0,neutral
2022-10-21 00:00:00,AAPL,US STOCKS-Nasdaq futures slide 1% as Snap's ad warning spurs social media selloff,-1.0,0.1,negative
2022-10-21 00:00:00,AAPL,Want to Get Richer? 3 Top Stocks to Buy Now and Hold Forever,0.5,0.5,positive
2022-10-21 00:00:00,AAPL,Zuckerberg's Metaverse Bet Is More Than Experimental - It's Key to Meta's Survival,0.19999999999999998,0.6333333333333333,positive
2022-10-21 00:00:00,AAPL,77% of Warren Buffett's $313 Billion Portfolio Is Invested in These 6 Stocks,0.0,0.0,neutral
2022-10-21 00:00:00,AAPL,"2 Reasons to Buy Apple Stock, and 1 Reason to Sell",0.0,0.0,neutral
2022-10-20 00:00:00,AAPL,Apple (AAPL) Earnings Expected to Grow: Should You Buy?,-0.1,0.4,neutral
2022-10-20 00:00:00,AAPL,Foxconn says production normal at iPhone plant in China despite COVID curbs,0.15,0.6499999999999999,positive
2022-10-20 00:00:00,AAPL,How Critical Is This Earnings Season?,0.0,0.8,neutral
2022-10-20 00:00:00,AAPL,"After Hours Most Active for Oct 20, 2022 : SNAP, ATUS, IMUX, ADT, DDL, AUY, IHS, ESGU, TQQQ, AAPL, MQ, QQQ",0.18333333333333335,0.55,positive
2022-10-20 00:00:00,AAPL,Microsoft (MSFT) to Report Q1 Earnings: What's in the Cards?,0.0,0.0,neutral
2022-10-20 00:00:00,AAPL,Apple Reports After the Close on 10/27 -- Options Contracts Expire the Next Day,0.0,0.0,neutral
2022-10-20 00:00:00,AAPL,Meta Platforms (META) Banks on AI to Boost Growth Prospects,1.0,0.2,positive
2022-10-20 00:00:00,AAPL,MSCI Scheduled to Report Q3 Earnings: What's in the Cards?,0.0,0.0,neutral
2022-10-20 00:00:00,AAPL,Amazon faces $1 bln lawsuit in UK for 'favouring its own products',-1.0,0.1,negative
2022-10-20 00:00:00,AAPL,Is Goldman Sachs ActiveBeta World Low Vol Plus Equity ETF (GLOV) a Strong ETF Right Now?,1.0,0.1,positive
2022-10-20 00:00:00,AAPL,My Top 2 Dividend Stocks to Buy Now,0.5,0.5,positive
2022-10-20 00:00:00,AAPL,"Taiwan Sept export orders contract, but strong electronics sales reported",1.0,0.1,positive
2022-10-20 00:00:00,AAPL,"Nokia, Ericsson slump as patent fights hit margins",0.0,0.0,neutral
2022-10-20 00:00:00,AAPL,Thursday's ETF with Unusual Volume: FTHI,0.2,1.0,positive
2022-10-19 00:00:00,AAPL,US STOCKS-Wall St struggles to gain as soaring Treasury yields hurt earnings confidence,1.0,0.2,positive
2022-10-19 00:00:00,AAPL,SNAP Earnings Preview: Can the Social Media Stock Finally Rebound?,0.016666666666666666,0.5333333333333333,neutral
2022-10-19 00:00:00,AAPL,Tesla’s Apple-sized goals have cash risks,-1.0,0.1,negative
2022-10-19 00:00:00,AAPL,PREVIEW-Digital ad market shows 'signs of life' but economy clouds 2023 outlook,0.0,0.0,neutral
2022-10-19 00:00:00,AAPL,"Netflix (NFLX) Q3 Earnings Beat, User Gain Higher Than Expected",1.0,0.3,positive
2022-10-19 00:00:00,AAPL,Apple (AAPL) Expands Portfolio With Redesigned & Next-Gen iPads,0.0,0.0,neutral
2022-10-19 00:00:00,AAPL,"Taiwan-China, U.S.-China tensions 'serious' challenge for chip industry, TSMC says",-0.3333333333333333,0.6666666666666666,negative
2022-10-19 00:00:00,AAPL,Zacks Industry Outlook Highlights Apple and 3D Systems,1.0,0.1,positive
2022-10-19 00:00:00,AAPL,"Investor group, unions push Hyundai to address child labor at U.S. suppliers",0.0,0.0,neutral
2022-10-19 00:00:00,AAPL,Taiwan and U.S. tensions with China pose 'serious' challenges for chip industry - TSMC,-0.3333333333333333,0.6666666666666666,negative
2022-10-19 00:00:00,AAPL,"1 Growth Stock Set to Soar 1,000%, According to Cathie Wood",1.0,0.2,positive
2022-10-19 00:00:00,AAPL,US STOCKS-Wall St set to open lower as soaring Treasury yields dampen Netflix-led gains,1.0,0.2,positive
2022-10-18 00:00:00,AAPL,"Notable ETF Inflow Detected - VOO, AAPL, MSFT, GOOG",0.5,0.5,positive
2022-10-18 00:00:00,AAPL,"US STOCKS-Wall St up as Goldman results keep optimism alive, rising yields cap gains",1.0,0.1,positive
2022-10-18 00:00:00,AAPL,POLL-Taiwan Sept export orders likely contracted,0.0,1.0,neutral
2022-10-18 00:00:00,AAPL,Apple (AAPL) Gains But Lags Market: What You Should Know,1.0,0.1,positive
2022-10-18 00:00:00,AAPL,Mexican opposition lawmaker says he was target of Pegasus spyware,0.0,0.0,neutral
2022-10-18 00:00:00,AAPL,"US STOCKS-Goldman, Lockheed results buoy Wall Street",0.0,0.0,neutral
2022-10-18 00:00:00,AAPL,"Apple Unveils New IPad Pros, IPad And Apple TV 4K",0.13636363636363635,0.45454545454545453,positive
2022-10-18 00:00:00,AAPL,Apple cuts production of iPhone 14 Plus - the Information,0.0,0.0,neutral
2022-10-18 00:00:00,AAPL,EXPLAINER-Parler: what is the social media app Kanye West is buying?,0.03333333333333333,0.06666666666666667,neutral
2022-10-18 00:00:00,AAPL,Diving into the FAANG Stock Earnings Charts,0.0,0.0,neutral
2022-10-18 00:00:00,AAPL,Apple cuts production of iPhone 14 Plus - the Information,0.0,0.0,neutral
2022-10-18 00:00:00,AAPL,Will Top-Line Contraction Dent AT&T's (T) Earnings in Q3?,0.0,0.0,neutral
2022-10-18 00:00:00,AAPL,"US STOCKS-Wall St set to jump at open as Goldman, J&J results lift earnings mood",1.0,0.1,positive
2022-10-18 00:00:00,AAPL,Why Microsoft Is Down 29% This Year,-0.15555555555555556,0.2888888888888889,negative
2022-10-18 00:00:00,AAPL,"Pre-Market Most Active for Oct 18, 2022 : TQQQ, SQQQ, AKUS, TSLA, QQQ, FUBO, CCL, NIO, AAPL, XPEV, HLN, APE",0.18333333333333335,0.55,positive
2022-10-18 00:00:00,AAPL,"The Zacks Analyst Blog Highlights Apple, Abbott Laboratories, International Business Machines, Estee Lauder and Progressive",1.0,0.1,positive
2022-10-18 00:00:00,AAPL,US STOCKS-Futures firmly up as J&J results boost earnings optimism,1.0,0.1,positive
2022-10-18 00:00:00,AAPL,US STOCKS-Futures extend rally on earnings optimism,1.0,0.1,positive
2022-10-18 00:00:00,AAPL,Apple Is Using Streaming to Unlock Another Growing Business,1.0,0.1,positive
2022-10-18 00:00:00,AAPL,"PREVIEW-Goldman to merge investment banking, trading as Marcus takes backseat",0.0,0.0,neutral
2022-10-18 00:00:00,AAPL,US STOCKS-Wall St climbs as Goldman winds up big bank earnings on upbeat note,1.0,0.2,positive
2022-10-18 00:00:00,AAPL,What Are The Best Stocks To Invest In? 3 Growth Stocks For Your List,1.0,0.1,positive
2022-10-17 00:00:00,AAPL,"US STOCKS-Wall Street jumps after BofA results, UK reversal",1.0,0.1,positive
2022-10-17 00:00:00,AAPL,US STOCKS-Wall Street jumps as BofA results spark rally,1.0,0.2,positive
2022-10-17 00:00:00,AAPL,Charter's (CHTR) Spectrum Expands Operations in Loudon County,0.0,0.0,neutral
2022-10-17 00:00:00,AAPL,"Q3 Earnings Scorecard and Analyst Reports for Apple, Abbott, IBM & Others",0.0,0.0,neutral
2022-10-17 00:00:00,AAPL,Are You a Growth Investor? This 1 Stock Could Be the Perfect Pick,1.0,0.1,positive
2022-10-17 00:00:00,AAPL,US STOCKS-Wall Street surges as BofA gains on earnings beat,1.0,0.3,positive
2022-10-17 00:00:00,AAPL,"US STOCKS-Wall Street rallies after BofA results, UK reversal",0.0,0.0,neutral
2022-10-17 00:00:00,AAPL,"US STOCKS-Wall Street rallies after BofA results, UK reversal",0.0,0.0,neutral
2022-10-17 00:00:00,AAPL,Taiwan's Foxconn says wants its customers to sell a lot of EVs,0.2,0.1,positive
2022-10-17 00:00:00,AAPL,Taiwan's Foxconn says it wants customers to sell 'a lot' of EVs,0.2,0.1,positive
2022-10-17 00:00:00,AAPL,US STOCKS-Wall Street jumps as solid BofA results spark rally,1.0,0.2,positive
2022-10-17 00:00:00,AAPL,Should First Trust Rising Dividend Achievers ETF (RDVY) Be on Your Investing Radar?,0.25,0.3333333333333333,positive
2022-10-17 00:00:00,AAPL,Alphabet (GOOGL) Enhances YouTube With Homescreen Widgets,0.0,0.0,neutral
2022-10-17 00:00:00,AAPL,India's Reliance Jio selects Nokia as equipment provider in 5G push,0.0,0.0,neutral
2022-10-17 00:00:00,AAPL,US STOCKS-Wall St futures higher with focus on earnings,1.0,0.1,positive
2022-10-17 00:00:00,AAPL,Here's the FAANG Stock Wall Street Thinks Will Soar the Most Over the Next 12 Months,1.0,0.1,positive
2022-10-17 00:00:00,AAPL,Apple freezes plans to use China's YMTC chips - Nikkei,0.0,0.0,neutral
2022-10-17 00:00:00,AAPL,"Stock Market News for Oct 17, 2022",0.0,0.0,neutral
2022-10-17 00:00:00,AAPL,Should Schwab 1000 Index ETF (SCHK) Be on Your Investing Radar?,0.0,0.0,neutral
2022-10-17 00:00:00,AAPL,2 Stocks to Watch From the Challenging Computer Industry,0.5,1.0,positive
2022-10-17 00:00:00,AAPL,Mercedes-Benz Adds Apple Music With Spatial Audio,0.0,0.0,neutral
2022-10-17 00:00:00,AAPL,Is Invesco Dynamic Large Cap Growth ETF (PWB) a Strong ETF Right Now?,1.0,0.2,positive
2022-10-17 00:00:00,AAPL,US STOCKS-Wall Street set to open higher as BofA rises on earnings beat,1.0,0.3,positive
2022-10-16 00:00:00,AAPL,Why Occidental Petroleum Could Be Warren Buffett's Next Apple,0.0,0.0,neutral
2022-10-16 00:00:00,AAPL,"$5,000 Invested in These Growth Stocks Could Make You Rich Over the Next 10 Years",1.0,0.1,positive
2022-10-16 00:00:00,AAPL,"5 Stocks That Turned a $10,000 Investment Into $1 Million",0.0,0.0,neutral
2022-10-16 00:00:00,AAPL,I've Already Made 158% on Bitcoin. Here's Why I Keep Holding.,0.0,0.0,neutral
2022-10-15 00:00:00,AAPL,Apple Workers In Oklahoma City Win Union Election To Join CWA,1.0,0.1,positive
2022-10-15 00:00:00,AAPL,"Market News From AMD, McCormick, Peloton, and More",0.5,0.5,positive
2022-10-15 00:00:00,AAPL,Nasdaq Bear Market: What History Taught Investors,0.0,0.0,neutral
2022-10-15 00:00:00,AAPL,An Investor's Look at Semiconductors,0.0,0.0,neutral
2022-10-15 00:00:00,AAPL,How Warren Buffett Receives a Staggering 54% Yield From This Dividend Aristocrat,0.0,0.0,neutral
2022-10-14 00:00:00,AAPL,"Banks Are Now as Leveraged as They Were Before the Great Recession, but Don't Panic",0.8,0.75,positive
2022-10-14 00:00:00,AAPL,Friday's ETF with Unusual Volume: FCTR,0.2,1.0,positive
2022-10-14 00:00:00,AAPL,"After Hours Most Active for Oct 14, 2022 : SMRT, RTO, PING, QQQ, HBAN, AAPL, AMZN, LBRT, C, VZ, INTC, TQQQ",0.18333333333333335,0.55,positive
2022-10-14 00:00:00,AAPL,Netflix (NFLX) Gears Up for Q3 Earnings: What's in the Cards?,0.0,0.0,neutral
2022-10-14 00:00:00,AAPL,"ROKU Expands The Roku Channel Internationally, Grows Library",0.0,0.0,neutral
2022-10-14 00:00:00,AAPL,Apple workers vote to unionize second U.S. store,0.0,0.0,neutral
2022-10-14 00:00:00,AAPL,Is This Top Warren Buffett Dividend Stock a Buy Now?,0.5,0.5,positive
2022-10-14 00:00:00,AAPL,Investing in This ETF Right Now Could Make You a Millionaire Retiree,0.2857142857142857,0.5357142857142857,positive
2022-10-14 00:00:00,AAPL,3 Best Buffett Stocks to Buy for the Long Haul,0.475,0.35,positive
2022-10-14 00:00:00,AAPL,"Company News for Oct 14, 2022",0.0,0.0,neutral
2022-10-14 00:00:00,AAPL,Microsoft Just Gave Meta Platforms a Big Vote of Confidence,0.0,0.1,neutral
2022-10-13 00:00:00,AAPL,Metaverse Woes: Meta Platforms Can't Even Get Its Own Employees Excited About the Metaverse,0.4875,0.875,positive
2022-10-13 00:00:00,AAPL,Apple Card To Allow Users Grow Daily Cash Rewards,0.0,0.0,neutral
2022-10-13 00:00:00,AAPL,"Financial Sector Update for 10/13/2022: NVEI, NVEI.TO, GS, AAPL, PGR",0.0,0.0,neutral
2022-10-13 00:00:00,AAPL,"Noteworthy Thursday Option Activity: AAPL, DOCU, AYX",0.0,0.0,neutral
2022-10-13 00:00:00,AAPL,Chipmaker TSMC's shares leap after profit beats estimates,1.0,0.2,positive
2022-10-13 00:00:00,AAPL,"Financial Sector Update for 10/13/2022: BFST, NVEI, NVEI.TO, GS, AAPL, PGR",0.0,0.0,neutral
2022-10-13 00:00:00,AAPL,Netflix Earnings Preview: Can NFLX Get its Mojo Back?,0.0,0.0,neutral
2022-10-13 00:00:00,AAPL,Microsoft (MSFT) Brings Apple iCloud Integration to Windows,1.0,0.1,positive
2022-10-13 00:00:00,AAPL,Microsoft (MSFT) Rolls Out New Surface Products: Key Takeaways,0.06818181818181818,0.7272727272727273,neutral
2022-10-13 00:00:00,AAPL,"Brazil court fines Apple, orders to sell iPhone with charger",0.0,0.0,neutral
2022-10-13 00:00:00,AAPL,3 Incredibly Cheap Blue Chip Stocks to Buy Right Now,0.22857142857142856,0.4452380952380952,positive
2022-10-13 00:00:00,AAPL,Why Apple Stock Is Down 23% This Year,-0.15555555555555556,0.2888888888888889,negative
2022-10-13 00:00:00,AAPL,Big Tech's hiring freeze unlocks rich talent pool for U.S. startups,0.1875,0.425,positive
2022-10-13 00:00:00,AAPL,"TSMC Q3 profit jumps 80%, beats market expectations",1.0,0.3,positive
2022-10-13 00:00:00,AAPL,"TSMC Q3 profit jumps 80%, beats market expectations",1.0,0.3,positive
2022-10-13 00:00:00,AAPL,US STOCKS-Wall St falls as hot inflation data drives fears of big rate hike,-1.0,0.1,negative
2022-10-13 00:00:00,AAPL,1 Reason You Don't Want to Own PC Makers Like HP and Dell Right Now,0.44285714285714284,0.7678571428571428,positive
2022-10-13 00:00:00,AAPL,"5 Stocks That Turned a $5,000 Investment Into $1 Million",0.0,0.0,neutral
2022-10-13 00:00:00,AAPL,"The Zacks Analyst Blog Highlights NVIDIA, Alphabet, Apple, Snap and Autodesk",1.0,0.1,positive
2022-10-12 00:00:00,AAPL,Bear of the Day: HP (HPQ),0.0,0.0,neutral
2022-10-12 00:00:00,AAPL,"Apple, Samsung To Upgrade For 5G In India By December",1.0,0.1,positive
2022-10-12 00:00:00,AAPL,"After Hours Most Active for Oct 12, 2022 : RTO, TLT, PTVE, C, QQQ, SHY, CG, AAPL, JPM, NKE, PPL, BAC",-0.04444444444444443,0.5333333333333333,neutral
2022-10-12 00:00:00,AAPL,"ITOT, NUAG: Big ETF Outflows",0.0,0.1,neutral
2022-10-12 00:00:00,AAPL,Why Apple (AAPL) Could Beat Earnings Estimates Again,1.0,0.2,positive
2022-10-12 00:00:00,AAPL,"US STOCKS-S&P 500, Nasdaq rise after five-day selloff, rate-hike fears weigh",1.0,0.1,positive
2022-10-12 00:00:00,AAPL,"2 Warren Buffett Stocks to Buy That Could Soar 80% and 91%, According to Wall Street",1.0,0.1,positive
2022-10-12 00:00:00,AAPL,1 Glorious Growth Stock Defying the Nasdaq Bear Market This Year,1.0,0.1,positive
2022-10-12 00:00:00,AAPL,Sirius XM (SIRI) to Open a Broadcast Center in Miami in 2023,-0.05,0.3,neutral
2022-10-12 00:00:00,AAPL,US STOCKS-Wall St futures pare gains as inflation data cements rate hike bets,1.0,0.1,positive
2022-10-12 00:00:00,AAPL,"The Zacks Analyst Blog Highlights HP, Dell, Apple and Lenovo",1.0,0.1,positive
2022-10-12 00:00:00,AAPL,"US STOCKS-Wall St futures rise ahead of inflation data, Fed minutes",1.0,0.1,positive
2022-10-12 00:00:00,AAPL,3 Top Metaverse Stocks to Buy in October,0.5,0.5,positive
2022-10-12 00:00:00,AAPL,"US STOCKS-Wall St futures rise with focus on inflation data, Fed minutes",1.0,0.1,positive
2022-10-12 00:00:00,AAPL,"If You Invested $10,000 In Apple for Its IPO In 1980, Here's How Much You'd Have Now",0.2,0.2,positive
2022-10-12 00:00:00,AAPL,"Apple, Samsung to upgrade phone software in India for 5G roll out by Dec",1.0,0.1,positive
2022-10-12 00:00:00,AAPL,5 Stocks to Gain From the Flourishing Metaverse Space,1.0,0.1,positive
