date,ticker,headline,polarity,subjectivity,sentiment
2023-12-16 22:00:00,AAPL,My 6 Largest Portfolio Holdings Heading Into 2024 -- and the Important Investing Lesson I Learned From Each One,0.4,1.0,positive
2023-12-16 22:00:00,AAPL,Brokers Suggest Investing in Apple (AAPL): Read This Before Placing a Bet,0.0,0.0,neutral
2023-12-16 21:00:00,AAPL,"Company News for Dec 19, 2023",0.0,0.0,neutral
2023-12-16 21:00:00,AAPL,NVIDIA (NVDA) Up 243% YTD: Will It Carry Momentum in 2024?,0.0,0.0,neutral
2023-12-16 21:00:00,AAPL,"Pre-Market Most Active for Dec 19, 2023 : BMY, SQQQ, NIO, UBS, TQQQ, UBER, NVDA, AAPL, GOTU, CAN, TSLA, PLTR",0.18333333333333335,0.55,positive
2023-12-16 20:00:00,AAPL,3 Artificial Intelligence (AI) Stocks for 2024 (and Beyond),-0.6,1.0,negative
2023-12-16 20:00:00,AAPL,AAPL Quantitative Stock Analysis,0.0,0.0,neutral
2023-12-16 18:00:00,AAPL,Should Vanguard S&P 500 ETF (VOO) Be on Your Investing Radar?,0.0,0.0,neutral
2023-12-16 18:00:00,AAPL,Is FlexShares Quality Dividend ETF (QDF) a Strong ETF Right Now?,1.0,0.1,positive
2023-12-16 18:00:00,AAPL,Is FlexShares STOXX US ESG Select Index Fund (ESG) a Strong ETF Right Now?,1.0,0.1,positive
2023-12-16 18:00:00,AAPL,Wall St futures inch up as investors pin hopes on Fed rate cuts,0.0,0.0,neutral
2023-12-16 18:00:00,AAPL,49.1% of Warren Buffett's $373 Billion Portfolio Is Invested in 3 Artificial Intelligence (AI) Stocks,-0.6,1.0,negative
2023-12-16 17:00:00,AAPL,2 Top Warren Buffett Stocks to Buy Right Now,0.39285714285714285,0.5178571428571428,positive
2023-12-16 15:00:00,AAPL,TSMC to promote from within after chairman retires next year,0.0,0.0,neutral
2023-12-16 04:00:00,AAPL,"US STOCKS-Wall Street ends higher, extending rate-cut rally",1.0,0.2,positive
2023-12-16 04:00:00,AAPL,"After Hours Most Active for Dec 18, 2023 : PACB, AAPL, VTIP, EDAP, FTNT, AMZN, HPE, SKT, VZ, MRK, BVN, PFE",0.18333333333333335,0.55,positive
2023-12-16 04:00:00,AAPL,"Technology Sector Update for 12/18/2023: PCT, ADBE, AAPL, EBIX",0.0,0.0,neutral
2023-12-16 04:00:00,AAPL,"Wall Street ends higher, extending rate-cut rally",1.0,0.2,positive
2023-12-16 04:00:00,AAPL,Apple To Halt Sale Of Watch Series 9 And Ultra 2,0.0,0.0,neutral
2023-12-16 02:00:00,AAPL,US STOCKS-Wall St builds on rally as Fed euphoria lingers,1.0,0.1,positive
2023-12-16 02:00:00,AAPL,"Technology Sector Update for 12/18/2023: ADBE, AAPL, EBIX",0.0,0.0,neutral
2023-12-16 00:00:00,AAPL,FOCUS-Goldman Sachs faces rocky exit from Apple credit card partnership,0.0,0.0,neutral
2023-12-16 00:00:00,AAPL,EXCLUSIVE-US lawmakers warn Biden to probe EU targeting of tech firms -letter,-1.0,0.1,negative
2023-12-16 00:00:00,AAPL,Can the 'Magnificent Seven' Continue to Lead the Market Higher in 2024?,1.0,0.1,positive
2023-12-16 00:00:00,AAPL,EXCLUSIVE-US lawmakers urge Biden to probe EU targeting of tech firms -letter,-1.0,0.1,negative
2023-12-16 00:00:00,AAPL,"Dow Movers: INTC, CVX",0.0,0.0,neutral
2023-12-16 00:00:00,AAPL,"US STOCKS-Oil stocks lead Wall Street higher, U.S. Steel soars on buyout deal",1.0,0.2,positive
2023-12-16 00:00:00,AAPL,"Apple to halt US sales of Series 9, Ultra 2 smartwatches on patent dispute",0.0,0.0,neutral
2023-12-16 00:00:00,AAPL,3 Outstanding Stocks to Buy if Interest Rates Fall Next Year,-1.0,0.1,negative
2023-12-16 00:00:00,AAPL,"US STOCKS-Wall St on course for higher open, eyes on data",1.0,0.1,positive
2023-12-16 00:00:00,AAPL,"Some Potential 2024 Winners Reside in QQQ, QQQM",1.0,0.1,positive
2023-12-16 00:00:00,AAPL,The Fed Pivot Arrives: The Magnificent Seven Should Benefit,1.0,1.0,positive
2023-12-16 00:00:00,AAPL,This Is Apple's Most Important Growth Product Today (Hint: It's Not the iPhone),1.0,0.1,positive
2023-12-16 00:00:00,AAPL,3 Stocks You Can Confidently Buy After a Market Downturn,0.5,0.8333333333333334,positive
2023-12-16 00:00:00,AAPL,Should Vanguard S&P 500 Growth ETF (VOOG) Be on Your Investing Radar?,1.0,0.1,positive
2023-12-16 00:00:00,AAPL,Should Vanguard Mega Cap ETF (MGC) Be on Your Investing Radar?,0.0,0.0,neutral
2023-12-16 00:00:00,AAPL,Should iShares Russell Top 200 Growth ETF (IWY) Be on Your Investing Radar?,1.0,0.1,positive
2023-12-16 00:00:00,AAPL,Should SPDR S&P 500 ETF (SPY) Be on Your Investing Radar?,0.0,0.0,neutral
2023-12-16 00:00:00,AAPL,Warren Buffett Has Gained Over $196 Billion From Only 4 Stocks,1.0,0.1,positive
2023-12-16 00:00:00,AAPL,"Tech hedge funds soar, piggybacking on Nasdaq rally",1.0,0.2,positive
2023-12-15 00:00:00,AAPL,Intel's AI PC Chips Are a Big Step Forward,0.0,0.1,neutral
2023-12-15 00:00:00,AAPL,Will Nvidia Be Worth More Than Apple by 2030?,0.4,0.3,positive
2023-12-15 00:00:00,AAPL,57.7% of Warren Buffett's $375 Billion Portfolio Is Invested in These 2 Dividend-Paying Stocks,0.0,0.0,neutral
2023-12-15 00:00:00,AAPL,Guru Fundamental Report for AAPL,0.0,0.0,neutral
2023-12-15 00:00:00,AAPL,These 3 Stocks Have Made Warren Buffett the Most Money in 2023. Are They No-Brainer Buys for the New Year?,0.3181818181818182,0.4772727272727273,positive
2023-12-14 00:00:00,AAPL,3 No-Brainer Dividend Stocks to Buy and Hold for 20 Years,0.0,0.0,neutral
2023-12-14 00:00:00,AAPL,Almost Half of Warren Buffett-led Berkshire Hathaway's $365 Billion Portfolio Is Invested in Only 1 Stock,-0.08333333333333333,0.5833333333333334,neutral
2023-12-14 00:00:00,AAPL,2 Hot Warren Buffett Stocks That Raised Their Dividends This Year,0.25,0.8500000000000001,positive
2023-12-14 00:00:00,AAPL,"PayPal Is a Smart Stock to Buy on the Dip, but There's 1 Warning",-1.0,0.1,negative
2023-12-14 00:00:00,AAPL,China's ban on Apple's iPhone accelerates- Bloomberg News,0.0,0.0,neutral
2023-12-14 00:00:00,AAPL,"Got $1,000? Here Are 2 Stocks to Buy for the Long Haul",-0.05,0.4,neutral
2023-12-14 00:00:00,AAPL,"After Hours Most Active for Dec 15, 2023 : UBER, LCID, PFE, KO, AAPL, PCG, EBAY, ALK, MSFT, SEE, CSCO, XP",0.18333333333333335,0.55,positive
2023-12-14 00:00:00,AAPL,Insider Buying: C-Suite EV Executive Just Loaded Up on $2M of this Auto Stock,0.0,0.0,neutral
2023-12-14 00:00:00,AAPL,Want to Be in the AI Millionaires Club? 3 Top Stocks You Need to Own Now,0.55,0.75,positive
2023-12-14 00:00:00,AAPL,ETF Market Outlook & Investing Strategies for 2024,0.0,0.0,neutral
2023-12-13 00:00:00,AAPL,"Zacks Investment Ideas feature highlights: Tesla, Apple and Rivian",1.0,0.1,positive
2023-12-13 00:00:00,AAPL,"The Zacks Analyst Blog Highlights Salesforce, Intel, Microsoft, Apple and Boeing",1.0,0.1,positive
2023-12-13 00:00:00,AAPL,"Apple sued with Visa, Mastercard in card-fee antitrust case",0.0,0.0,neutral
2023-12-13 00:00:00,AAPL,2 Great Passive Income Stocks to Buy for 2024,0.8,0.75,positive
2023-12-13 00:00:00,AAPL,Validea Detailed Fundamental Analysis - AAPL,0.4,0.75,positive
2023-12-13 00:00:00,AAPL,5 Tech ETFs that Crushed the Magnificent Seven ETFs in 2023,0.45,0.55,positive
2023-12-13 00:00:00,AAPL,1 Warren Buffett Stock That Could Go Parabolic in 2024,0.0,0.0,neutral
2023-12-13 00:00:00,AAPL,Best Stock to Buy: Apple vs. Coca-Cola,1.0,0.3,positive
2023-12-13 00:00:00,AAPL,Will Apple Stock Reign Supreme Yet Again in 2024?,1.0,0.1,positive
2023-12-13 00:00:00,AAPL,1 Ultra-High Dividend Yield Stock to Buy Hand Over Fist in 2024,1.0,0.1,positive
2023-12-13 00:00:00,AAPL,The Dow Jones Just Hit a Record High. History Says Stocks Will Do This Next.,1.0,0.2,positive
2023-12-13 00:00:00,AAPL,Tesla Stock Can Soar in 2024 if It Does These 3 Things,1.0,0.1,positive
2023-12-13 00:00:00,AAPL,"Technology Sector Update for 12/14/2023: ADBE, MVIS, AAPL, GOOG",0.0,0.0,neutral
2023-12-13 00:00:00,AAPL,Magnificent Seven Could Deliver More Gains in 2024,1.0,0.1,positive
2023-12-13 00:00:00,AAPL,Apple (AAPL) Advances But Underperforms Market: Key Facts,1.0,0.1,positive
2023-12-13 00:00:00,AAPL,US STOCKS-Dow scores second record close in a row on lower-rate bets,1.0,0.1,positive
2023-12-13 00:00:00,AAPL,US STOCKS-S&P 500 ends higher as investors bet on lower rates,1.0,0.1,positive
2023-12-13 00:00:00,AAPL,"US STOCKS-Wall St subdued, day after rally on Fed statement",1.0,0.1,positive
2023-12-13 00:00:00,AAPL,"Earnings Season Update and Analyst Reports for Apple, Bank of America & S&P Global",0.0,0.0,neutral
2023-12-13 00:00:00,AAPL,3 Strong Buy Stocks for a Year-End Pickup,1.0,0.1,positive
2023-12-13 00:00:00,AAPL,Meet the 1 Stock Warren Buffett Is Virtually Guaranteed to Be Buying Throughout 2024,0.0,0.0,neutral
2023-12-13 00:00:00,AAPL,MSFT vs. AAPL: Which Stock Has More AI Upside Potential?,0.25,0.75,positive
2023-12-12 00:00:00,AAPL,5 Best-Performing Technology ETFs of 2023,0.0,0.0,neutral
2023-12-12 00:00:00,AAPL,Jabil's quarterly profit beats estimates as cost cutting measures takeoff,1.0,0.2,positive
2023-12-12 00:00:00,AAPL,Market Misfits: 3 Beaten-Down Stocks Poised for a 2024 Comeback,1.0,0.1,positive
2023-12-12 00:00:00,AAPL,Intel says dozens of PC makers are using its new AI-enabled chip,0.13636363636363635,0.45454545454545453,positive
2023-12-12 00:00:00,AAPL,2 'Strong Buy' Warren Buffett Stocks to Invest In Now,1.0,0.1,positive
2023-12-12 00:00:00,AAPL,US STOCKS-Wall St rises on Fed's rate-cut signal; Apple scales record high,1.0,0.3,positive
2023-12-12 00:00:00,AAPL,5 Winning Stocks of 2023 as Dow Jones Hits New Record,1.0,0.2,positive
2023-12-12 00:00:00,AAPL,Where Will Apple Stock Be in 5 Years?,0.0,0.0,neutral
2023-12-12 00:00:00,AAPL,"EU asks Apple, Google to clarify app store risk management",-1.0,0.1,negative
2023-12-12 00:00:00,AAPL,Zacks Investment Ideas feature highlights: Apple,1.0,0.1,positive
2023-12-12 00:00:00,AAPL,Bob Iger Is Running Out of Time to Save Disney Stock,0.0,0.0,neutral
2023-12-12 00:00:00,AAPL,Berkshire Hathaway buys Occidental Petroleum shares worth about $588.7 mln,0.3,0.1,positive
2023-12-12 00:00:00,AAPL,"Got $1,000? 4 Stocks to Buy Now While They're on Sale.",0.0,0.0,neutral
2023-12-12 00:00:00,AAPL,Apple reaches record high close as Fed signals rate cuts,1.0,0.2,positive
2023-12-12 00:00:00,AAPL,80% of Warren Buffett's $313 Billion Portfolio Is in Just 5 Stocks. Find Out What He Owns Now.,0.0,0.0,neutral
2023-12-12 00:00:00,AAPL,"ANALYSIS-Investors cheer Fed's dovish pivot, as focus shifts to 2024 risks",-1.0,0.1,negative
2023-12-12 00:00:00,AAPL,Guru Fundamental Report for AAPL,0.0,0.0,neutral
2023-12-12 00:00:00,AAPL,"DGRW, CEW: Big ETF Inflows",0.0,0.1,neutral
2023-12-12 00:00:00,AAPL,"Technology Sector Update for 12/13/2023: AAPL, TTWO, META",0.0,0.0,neutral
2023-12-12 00:00:00,AAPL,Analysts Expect This Russell 2000 Penny Stock to Double,0.0,0.0,neutral
2023-12-12 00:00:00,AAPL,Foxconn to invest additional $1.7 bln in India's Karnataka state,0.0,0.0,neutral
2023-12-12 00:00:00,AAPL,Time for Apple ETFs on Optimism for Holiday Season & Beyond?,0.0,0.0,neutral
2023-12-12 00:00:00,AAPL,Apple Nears All-Time High: Is the Tech Giant Too Extended?,1.0,0.1,positive
2023-12-12 00:00:00,AAPL,1 Fintech Stock to Buy at a Bargain in December,1.0,0.1,positive
2023-12-12 00:00:00,AAPL,3 Stocking Stuffer Stocks to Buy for Your Loved Ones This Holiday,0.7,0.8,positive
2023-12-12 00:00:00,AAPL,Can Equal-Weighted ETFs Outperform the S&P 500 in 2024?,1.0,0.1,positive
2023-12-12 00:00:00,AAPL,The 7 Best Dow Stocks to Buy as America’s GDP Growth Soars,1.0,0.2,positive
2023-12-12 00:00:00,AAPL,Is Apple Stock a Buy Now?,0.0,0.0,neutral
2023-12-12 00:00:00,AAPL,Did the Santa Claus Rally Start Early?,1.0,0.1,positive
2023-12-12 00:00:00,AAPL,Apple Inc. (AAPL) Is a Trending Stock: Facts to Know Before Betting on It,0.0,0.0,neutral
2023-12-12 00:00:00,AAPL,Long Straddle Screener Results For December 12th,-0.05,0.4,neutral
2023-12-12 00:00:00,AAPL,AAPL Quantitative Stock Analysis,0.0,0.0,neutral
2023-12-12 00:00:00,AAPL,"After Hours Most Active for Dec 13, 2023 : RIVN, T, TLT, PM, CIM, NRDY, F, AMZN, MO, AAPL, MRTX, QQQ",0.18333333333333335,0.55,positive
2023-12-12 00:00:00,AAPL,"EXCLUSIVE-Apple offers to let rivals access tap-and-go tech in EU antitrust case, sources say",0.1,0.0,neutral
2023-12-12 00:00:00,AAPL,Should You Invest in the iShares Expanded Tech Sector ETF (IGM)?,0.0,0.0,neutral
2023-12-12 00:00:00,AAPL,"1 Unstoppable Stock Set to Join Apple, Microsoft, Amazon, Alphabet, and Nvidia in the $1 Trillion Club in 2024",0.0,0.0,neutral
2023-12-12 00:00:00,AAPL,"Up 149% YTD, How High Can Roku (NASDAQ:ROKU) Stock Go in 2024?",1.0,0.1,positive
2023-12-11 00:00:00,AAPL,Here’s What to Expect From Apple Stock in 2024,0.0,0.0,neutral
2023-12-11 00:00:00,AAPL,"Goldman (GS) to Expand Private Credit, Reshuffles Executives",0.0,0.375,neutral
2023-12-11 00:00:00,AAPL,"HYG, QGRW: Big ETF Inflows",0.0,0.1,neutral
2023-12-11 00:00:00,AAPL,"The ""Magnificent Seven"" Stocks Crushed Wall Street in 2023, but This Stock Could Continue the Party in 2024",0.45,0.55,positive
2023-12-11 00:00:00,AAPL,Is Lumentum a Top Stock to Buy in 2024?,0.5,0.5,positive
2023-12-11 00:00:00,AAPL,DGRW Has Hallmarks of a Great Dividend ETF,0.8,0.75,positive
2023-12-11 00:00:00,AAPL,AAPL Factor-Based Stock Analysis,0.0,0.0,neutral
2023-12-11 00:00:00,AAPL,"1 Stunning Stock Market Statistic That Will Have You Racing for the ""Buy"" Button",0.5,1.0,positive
2023-12-11 00:00:00,AAPL,Google's court loss to Epic Games may cost billions but final outcome years away,-1.0,0.1,negative
2023-12-11 00:00:00,AAPL,Apple to be hit by EU antitrust order in fight with Spotify - Bloomberg News,0.0,0.0,neutral
2023-12-11 00:00:00,AAPL,Can Shiba Inu Reach $0.01?,0.0,0.0,neutral
2023-12-11 00:00:00,AAPL,Warren Buffett Is Raking In Nearly $3.5 Billion in Annual Dividend Income From Just 4 Stocks,0.1,0.4,neutral
2023-12-11 00:00:00,AAPL,iPhone supplier Murata targets China budget smartphone makers,0.0,0.0,neutral
2023-12-11 00:00:00,AAPL,"After Hours Most Active for Dec 12, 2023 : AAPL, HST, CRH, COTY, MSFT, CCCC, BMY, QQQ, BAC, COMP, CMCSA, F",0.18333333333333335,0.55,positive
2023-12-11 00:00:00,AAPL,"Technology Sector Update for 12/12/2023: AAPL, ORCL, GOOG, NVEE",0.0,0.0,neutral
2023-12-11 00:00:00,AAPL,Apple now requires a judge's consent to hand over push notification data,0.0,0.0,neutral
2023-12-11 00:00:00,AAPL,2 Hypergrowth Tech Stocks to Buy in 2023 and Beyond,1.0,0.1,positive
2023-12-11 00:00:00,AAPL,Alphabet (GOOGL) Adds Loyalty Cards to Wallet App for Wear OS,0.0,0.0,neutral
2023-12-11 00:00:00,AAPL,This Warren Buffett Favorite Soared Nearly 50% This Year. Is It Too Late to Buy?,1.0,0.1,positive
2023-12-11 00:00:00,AAPL,Australia's central bank aims at broad reform for payments systems,0.03125,0.28125,neutral
2023-12-11 00:00:00,AAPL,Alphabet (GOOGL) Adds Generative AI Features to NotebookLM,0.0,0.0,neutral
2023-12-11 00:00:00,AAPL,Wall Street Says the S&P 500 Is Headed Higher in 2024: 2 No-Brainer Growth Stocks to Buy Now With $200 and Hold Long Term,1.0,0.2,positive
2023-12-11 00:00:00,AAPL,1 Warren Buffett ETF I'm Stocking Up On Before the End of 2023,0.0,0.0,neutral
2023-12-11 00:00:00,AAPL,Should SPDR Portfolio S&P 500 ETF (SPLG) Be on Your Investing Radar?,0.0,0.0,neutral
2023-12-11 00:00:00,AAPL,Should iShares S&P 100 ETF (OEF) Be on Your Investing Radar?,0.0,0.0,neutral
2023-12-11 00:00:00,AAPL,Australia's central bank flags broad payments system reforms,0.03125,0.28125,neutral
2023-12-11 00:00:00,AAPL,Don’t Wait! 3 Fearless Stocks to Buy Before Year-End,0.0,0.0,neutral
2023-12-11 00:00:00,AAPL,Epic Games CEO says company won in Google Play antitrust case,0.1,0.4,neutral
2023-12-11 00:00:00,AAPL,"After Hours Most Active for Dec 11, 2023 : CXM, INTC, PTEN, AMZN, SABR, ORCL, BMY, AAPL, CNHI, BEKE, WFC, KHC",0.18333333333333335,0.55,positive
2023-12-11 00:00:00,AAPL,"Notable Monday Option Activity: PAR, SABR, AAPL",0.5,0.5,positive
2023-12-11 00:00:00,AAPL,Could Apple Stock Plummet in 2024?,0.0,0.0,neutral
2023-12-11 00:00:00,AAPL,Is John Hancock Multifactor Large Cap ETF (JHML) a Strong ETF Right Now?,1.0,0.1,positive
2023-12-11 00:00:00,AAPL,"US STOCKS-S&P, Nasdaq subdued on caution ahead of inflation data, Fed meeting",0.0,0.0,neutral
2023-12-11 00:00:00,AAPL,"QUAL, GPIX: Big ETF Outflows",0.0,0.1,neutral
2023-12-11 00:00:00,AAPL,Netflix to livestream Nadal-Alcaraz face-off in March,0.0,0.0,neutral
2023-12-11 00:00:00,AAPL,ETF Investing Strategies for 2024,0.0,0.0,neutral
2023-12-10 00:00:00,AAPL,"1 Artificial Intelligence (AI) Stock Set to Join Apple, Amazon, Microsoft, Alphabet, and Nvidia in the $1 Trillion Club",-0.6,1.0,negative
2023-12-10 00:00:00,AAPL,"EV battery startup ONE names Paul Humphries as CEO, replacing founder",0.0,0.0,neutral
2023-12-10 00:00:00,AAPL,Guru Fundamental Report for AAPL,0.0,0.0,neutral
2023-12-10 00:00:00,AAPL,49.5% of Warren Buffett's $361 Billion Portfolio Is Invested in 3 Artificial Intelligence (AI) Stocks. And That Number's Getting Bigger.,-0.3,0.75,negative
2023-12-10 00:00:00,AAPL,Conspiracy theorist Alex Jones reinstated on X after Musk poll,0.0,0.0,neutral
2023-12-10 00:00:00,AAPL,U.S. Money Supply Is Shrinking the Most Since the Great Depression. Does It Spell Doom for the Stock Market in 2024?,0.65,0.625,positive
2023-12-10 00:00:00,AAPL,A Bull Market Is Coming: 3 Top Stocks to Buy Before the End of the Year,0.5,0.75,positive
2023-12-10 00:00:00,AAPL,My Top Stock to Buy Before the End Of 2023 That Could Create Generational Wealth,0.5,0.5,positive
2023-12-09 00:00:00,AAPL,3 Growth Stocks Primed for a 2024 Breakout,1.0,0.1,positive
2023-12-09 00:00:00,AAPL,3 Great Foreign Companies to Invest in Right Now,0.32023809523809527,0.4702380952380952,positive
2023-12-09 00:00:00,AAPL,This Is the Most Important AI Company You've Never Heard Of,0.45,0.75,positive
2023-12-09 00:00:00,AAPL,5 No-Brainer Stocks to Buy Before 2024,0.0,0.0,neutral
2023-12-08 00:00:00,AAPL,"American Micro Devices Stock Spikes Thanks to Artificial Intelligence (AI), Yet There's More to the Story",0.02500000000000001,0.425,neutral
2023-12-08 00:00:00,AAPL,Apple (AAPL) Rises Higher Than Market: Key Facts,1.0,0.2,positive
2023-12-08 00:00:00,AAPL,"Just 3 of the ""Magnificent Seven"" Have Outperformed the S&P 500 Since 2022. Here's the One I'd Buy for 2024 and 2025.",1.0,0.1,positive
2023-12-08 00:00:00,AAPL,Apple's iPhone and watch design head to depart in February - Bloomberg News,0.0,0.0,neutral
2023-12-08 00:00:00,AAPL,Best Stock to Buy: Apple vs. Shopify,1.0,0.3,positive
2023-12-08 00:00:00,AAPL,3 Warren Buffett Stocks You Can Buy in December and Hold Forever,0.0,0.0,neutral
2023-12-08 00:00:00,AAPL,Validea Detailed Fundamental Analysis - AAPL,0.4,0.75,positive
2023-12-08 00:00:00,AAPL,2 Unbelievable Tech Growth Stocks to Buy and Hold for the Long Haul,1.0,0.1,positive
2023-12-08 00:00:00,AAPL,79% of Warren Buffett's $363 Billion Portfolio Is Invested in Just 6 Stocks,0.0,0.0,neutral
2023-12-08 00:00:00,AAPL,Tata Plans New IPhone Assembly Plant In India,0.13636363636363635,0.45454545454545453,positive
2023-12-08 00:00:00,AAPL,Apple to move key iPad engineering resources to Vietnam- Nikkei,0.0,1.0,neutral
2023-12-08 00:00:00,AAPL,"Hundreds still stranded, plants closed in India's flood-hit Chennai",-0.1,0.1,neutral
2023-12-07 00:00:00,AAPL,US STOCKS-Nasdaq ends sharply higher as Alphabet and AMD fuel AI surge,1.0,0.2,positive
2023-12-07 00:00:00,AAPL,Apple-backed study finds rise in data breaches as iPhone maker defends encryption stance,1.0,0.1,positive
2023-12-07 00:00:00,AAPL,The 3 Stocks I Would Buy Today if I Was a Beginning Investor,0.0,0.0,neutral
2023-12-07 00:00:00,AAPL,The 3 Best Nasdaq Stocks to Buy in December,1.0,0.3,positive
2023-12-07 00:00:00,AAPL,Ex-Apple lawyer sentenced to probation for insider trading,0.0,0.0,neutral
2023-12-07 00:00:00,AAPL,Nasdaq ends sharply higher as Alphabet and AMD fuel AI surge,1.0,0.2,positive
2023-12-07 00:00:00,AAPL,US STOCKS-Alphabet and AMD fuel AI rally on Nasdaq,1.0,0.1,positive
2023-12-07 00:00:00,AAPL,"Tesla's Dojo supercomputer head leaves, former Apple exec to lead - Bloomberg News",0.0,0.0,neutral
2023-12-07 00:00:00,AAPL,"Dow Movers: MRK, AAPL",0.0,0.0,neutral
2023-12-07 00:00:00,AAPL,3D Systems (DDD) Up 27.9% Since Last Earnings Report: Can It Continue?,0.0,0.06666666666666667,neutral
2023-12-07 00:00:00,AAPL,2 No-Brainer Stocks I'd Buy Right Now Without Hesitation,0.2857142857142857,0.5357142857142857,positive
2023-12-07 00:00:00,AAPL,Guru Fundamental Report for AAPL,0.0,0.0,neutral
2023-12-07 00:00:00,AAPL,Best Stock to Buy: Apple vs. Amazon,1.0,0.3,positive
2023-12-07 00:00:00,AAPL,42% of Berkshire Hathaway's Entire Value Comes From Just 2 Investment Holdings,0.0,0.625,neutral
2023-12-07 00:00:00,AAPL,"US STOCKS-Wall St rises on Alphabet boost, payrolls data in focus",1.0,0.2,positive
2023-12-07 00:00:00,AAPL,AAPL Stock Outlook : Don’t Be Scared by the Noise,0.0,0.0,neutral
2023-12-07 00:00:00,AAPL,Warren Buffett Is on Track to Make $13.6 Billion in 2023. Here's Exactly How He'll Likely Do It.,0.125,0.625,positive
2023-12-07 00:00:00,AAPL,"Zacks Industry Outlook Highlights Apple, HP and 3D Systems",1.0,0.1,positive
2023-12-07 00:00:00,AAPL,"Apple at a $3 Trillion Market Cap: Buy, Sell, or Hold?",0.0,0.0,neutral
2023-12-06 00:00:00,AAPL,ROKU Collaborates With Tennis Channel to Launch T2 in the US,0.0,0.0,neutral
2023-12-06 00:00:00,AAPL,Apple Regains $3T in Market Cap: ETFs in Focus,1.0,0.1,positive
2023-12-06 00:00:00,AAPL,3 Stocks to Watch From the Prospering Computer Industry,0.0,0.0,neutral
2023-12-06 00:00:00,AAPL,"Governments spying on Apple, Google users through push notifications -US senator",0.0,0.0,neutral
2023-12-06 00:00:00,AAPL,AAPL Factor-Based Stock Analysis,0.0,0.0,neutral
2023-12-06 00:00:00,AAPL,3 Niche Tech Stocks With Untapped Potential,0.0,1.0,neutral
2023-12-06 00:00:00,AAPL,AI for the Future: 3 Stocks Driving Innovative Solutions,0.3333333333333333,0.7083333333333334,positive
2023-12-06 00:00:00,AAPL,"After Hours Most Active for Dec 6, 2023 : CCI, CHWY, BEKE, CNHI, AEO, BABA, QQQ, INTC, AAPL, GOOGL, PARA, MTCH",0.18333333333333335,0.55,positive
2023-12-06 00:00:00,AAPL,Better Growth Vehicle: Invesco QQQ Trust or Vanguard Information Technology Index Fund?,1.0,0.1,positive
2023-12-06 00:00:00,AAPL,"Stock Market News for Dec 6, 2023",0.0,0.0,neutral
2023-12-06 00:00:00,AAPL,"Decoding Apple’s Stock Trajectory: Time to Buy, Hold, or Sell AAPL?",0.0,0.0,neutral
2023-12-06 00:00:00,AAPL,US retail lobbyists retract key claim on 'organized' retail crime,0.0,1.0,neutral
2023-12-06 00:00:00,AAPL,48% of Warren Buffett's $363 Billion Portfolio Is Invested in Just 1 Stock,0.0,0.0,neutral
2023-12-06 00:00:00,AAPL,Is iShares Core S&P U.S. Growth ETF (IUSG) a Strong ETF Right Now?,1.0,0.2,positive
2023-12-06 00:00:00,AAPL,3 Artificial Intelligence (AI) Stocks With More Potential Than Any Cryptocurrency,-0.033333333333333326,0.8333333333333334,neutral
2023-12-06 00:00:00,AAPL,Is Goldman Sachs ActiveBeta World Low Vol Plus Equity ETF (GLOV) a Strong ETF Right Now?,1.0,0.1,positive
2023-12-06 00:00:00,AAPL,Apple told component suppliers to source iPhone 16 batteries from India- FT,0.0,0.0,neutral
2023-12-06 00:00:00,AAPL,Apple (NASDAQ:AAPL) Stock Reclaims $3 Trillion Market Cap; What Comes Next?,0.0,0.0,neutral
2023-12-06 00:00:00,AAPL,EXCLUSIVE-China EV maker Nio to spin off its battery production unit -sources,0.0,0.0,neutral
2023-12-06 00:00:00,AAPL,TipRanks All-Star Analyst – Who is the Best on AAPL Stock? ,1.0,0.3,positive
2023-12-05 00:00:00,AAPL,"Dow Movers: PG, AAPL",0.0,0.0,neutral
2023-12-05 00:00:00,AAPL,1 Small Fintech Stock That Could Soar in 2024,1.0,0.1,positive
2023-12-05 00:00:00,AAPL,"US STOCKS-Wall St mixed as traders assess economic data, megacaps rebound",0.1,0.225,neutral
2023-12-05 00:00:00,AAPL,"Tuesday Sector Leaders: Agriculture & Farm Products, Computers",0.0,0.0,neutral
2023-12-05 00:00:00,AAPL,High-Quality ETFs for Long-Term Investors,1.0,0.1,positive
2023-12-05 00:00:00,AAPL,Why Apple Stock Gained 11% in November,1.0,0.1,positive
2023-12-05 00:00:00,AAPL,US STOCKS-Trading mixed after job openings hint at cooling economy,0.0,0.25,neutral
2023-12-05 00:00:00,AAPL,US STOCKS-Wall Street ends mixed after job openings hint at cooling economy,0.0,0.25,neutral
2023-12-05 00:00:00,AAPL,"After Hours Most Active for Dec 5, 2023 : MRK, CRH, CNHI, MTCH, AAPL, SCPH, ABR, CMCSA, INBX, CSCO, SYF, HPQ",0.18333333333333335,0.55,positive
2023-12-05 00:00:00,AAPL,Is This Warren Buffett Stock Under $50 a Good Buy Right Now?,0.4928571428571428,0.5678571428571428,positive
2023-12-05 00:00:00,AAPL,"Nasdaq 100 Movers: PYPL, AAPL",0.0,0.0,neutral
2023-12-05 00:00:00,AAPL,Better Growth Stock: CRISPR Therapeutics vs. Invitae,1.0,0.1,positive
2023-12-05 00:00:00,AAPL,What to Expect from the Magnificent Seven Stocks in 2024,1.0,1.0,positive
2023-12-05 00:00:00,AAPL,Foxconn cancels first shift on Tuesday at Indian iPhone facility after extreme weather - sources,0.0625,0.6666666666666666,neutral
2023-12-05 00:00:00,AAPL,Nikkei posts sharpest drop in about 6 weeks as chip shares slide,-1.0,0.1,negative
2023-12-05 00:00:00,AAPL,Foxconn November sales up 18%,0.0,0.0,neutral
2023-12-05 00:00:00,AAPL,Foxconn raises Q4 outlook on strong year-end holiday sales,1.0,0.1,positive
2023-12-05 00:00:00,AAPL,AAPL Quantitative Stock Analysis,0.0,0.0,neutral
2023-12-05 00:00:00,AAPL,1 Unstoppable Vanguard ETF I'm Stocking Up On in 2024,0.0,0.0,neutral
2023-12-05 00:00:00,AAPL,"MORNING BID AMERICAS-Small caps pick up baton, China rating hit",0.0,0.0,neutral
2023-12-05 00:00:00,AAPL,Will Microsoft Overtake Apple as the World's Largest Company in 2024?,0.0,0.0,neutral
2023-12-05 00:00:00,AAPL,EXCLUSIVE-Apple warns India's EU-style charger rules will hit local production target,0.0,0.0,neutral
2023-12-04 00:00:00,AAPL,"Floods, nine killed as southern India braces for Cyclone Michaung",-0.1,0.0,neutral
2023-12-04 00:00:00,AAPL,"Floods, five killed as southern India braces for Cyclone Michaung",-0.1,0.0,neutral
2023-12-04 00:00:00,AAPL,Top ETF Stories of 2023,0.5,0.5,positive
2023-12-04 00:00:00,AAPL,US STOCKS-Wall Street ends down as megacaps give back gains,1.0,0.1,positive
