date,ticker,headline,polarity,subjectivity,sentiment
2023-04-17 00:00:00,AAPL,China smartphone sales rise to more than 70% of Russian market,1.0,0.1,positive
2023-04-17 00:00:00,AAPL,Apple's India sales hit $6 bln in year through March- Bloomberg News,0.0,0.0,neutral
2023-04-17 00:00:00,AAPL,Baidu and Tutor Perini have been highlighted as Zacks Bull and Bear of the Day,1.0,0.1,positive
2023-04-17 00:00:00,AAPL,Guru Fundamental Report for AAPL - Warren Buffett,0.0,0.0,neutral
2023-04-17 00:00:00,AAPL,Alphabet falls on report Samsung considering Bing as default search engine,-1.0,0.1,negative
2023-04-17 00:00:00,AAPL,Apple CEO Cook to meet Indian PM Modi amid expansion - sources,0.0,0.0,neutral
2023-04-17 00:00:00,AAPL,Alphabet shares fall on report Samsung may dump Google Search for Bing,-1.0,0.1,negative
2023-04-16 00:00:00,AAPL,Get In Now. 3 Stocks That Are Set to Soar.,1.0,0.1,positive
2023-04-16 00:00:00,AAPL,7 Dividend Stocks to Buy That Are Backed by Strong Cash Flows,1.0,0.1,positive
2023-04-16 00:00:00,AAPL,"Up 19% in 2023, Is It Safe to Invest in the Nasdaq Right Now?",0.39285714285714285,0.5178571428571428,positive
2023-04-16 00:00:00,AAPL,2 Warren Buffett Stocks to Buy Hand Over Fist and 1 to Avoid,0.0,0.0,neutral
2023-04-16 00:00:00,AAPL,3 Warren Buffett Stocks Worth Buying,0.3,0.1,positive
2023-04-16 00:00:00,AAPL,"2 Warren Buffett Stocks With 16% and 25% Downside, According to Wall Street",0.0,0.0,neutral
2023-04-16 00:00:00,AAPL,Warren Buffett Owns 2 Stocks in the $1 Trillion Club. Are They No-Brainer Buys Now?,0.0,0.0,neutral
2023-04-16 00:00:00,AAPL,5 Burning Questions for Verizon,0.0,0.0,neutral
2023-04-15 00:00:00,AAPL,Warren Buffett and Redditors Agree AAPL Is Still a Must-Buy Stock. Here’s Why.,0.0,0.0,neutral
2023-04-15 00:00:00,AAPL,5 Burning Questions for Apple,0.0,0.0,neutral
2023-04-15 00:00:00,AAPL,Where Gen Z Is Putting Their and Their Parents' Money,0.0,0.0,neutral
2023-04-15 00:00:00,AAPL,Apple PC Shipments Plummet In 2023 -- Time to Sell the Stock?,0.0,0.0,neutral
2023-04-15 00:00:00,AAPL,Is Cirrus Logic Stock a Buy Now?,0.0,0.0,neutral
2023-04-14 00:00:00,AAPL,"Stock Market News for Apr 14, 2023",0.0,0.0,neutral
2023-04-14 00:00:00,AAPL,Should Investors Buy Netflix Before Q1 Earnings?,0.0,0.0,neutral
2023-04-14 00:00:00,AAPL,"After Hours Most Active for Apr 14, 2023 : ALKS, BHC, V, BSX, CMCSA, QQQ, BMY, MU, AAPL, AMZN, BAC, NEM",0.18333333333333335,0.55,positive
2023-04-14 00:00:00,AAPL,Apple Stock (NASDAQ:AAPL): VR Headset Expectations May be Too Low,0.0,0.3,neutral
2023-04-14 00:00:00,AAPL,KSA: This Overlooked Saudi Arabia ETF is Outshining the U.S. Markets,0.0,0.0,neutral
2023-04-14 00:00:00,AAPL,Why These Simple S&P 500 ETFs Can Outperform This 12.4%-Yielding ETF,1.0,0.1,positive
2023-04-14 00:00:00,AAPL,2 Hypergrowth Tech Stocks to Buy in 2023 and Beyond,1.0,0.1,positive
2023-04-14 00:00:00,AAPL,"Zacks Investment Ideas feature highlights: Rambus, Nvidia, Microsoft, Apple and Netflix",1.0,0.1,positive
2023-04-14 00:00:00,AAPL,Better Buy: Apple Stock vs. Disney Stock,0.5,0.5,positive
2023-04-14 00:00:00,AAPL,"Warren Buffett Could Have Bought Any of 385 S&P 500 Companies With $66 Billion. Instead, He Piled It All Into 1 Stock",0.0,0.0,neutral
2023-04-14 00:00:00,AAPL,Analysts Turning Bullish on Some QQQ Components,1.0,0.1,positive
2023-04-14 00:00:00,AAPL,"Kulicke and Soffa Industries, Inc. Should Be On Your Watchlist",0.0,0.0,neutral
2023-04-13 00:00:00,AAPL,Canaccord Genuity Maintains Apple (AAPL) Buy Recommendation,0.0,0.0,neutral
2023-04-13 00:00:00,AAPL,Credit Suisse Maintains Apple (AAPL) Outperform Recommendation,1.0,0.1,positive
2023-04-13 00:00:00,AAPL,iShares Core S&P 500 ETF Experiences Big Inflow,0.0,0.1,neutral
2023-04-13 00:00:00,AAPL,US STOCKS-Wall St rallies to higher close as inflation data feeds Fed pause hopes,1.0,0.1,positive
2023-04-13 00:00:00,AAPL,"Technology Sector Update for 04/13/2023: AAPL, GOOG, GOOGL, AMZN, BABA",0.0,0.0,neutral
2023-04-13 00:00:00,AAPL,June 2nd Options Now Available For Apple,0.2,0.2,positive
2023-04-13 00:00:00,AAPL,"US STOCKS-Wall St surges as inflation, labor data raise Fed pause hopes",1.0,0.1,positive
2023-04-13 00:00:00,AAPL,"US STOCKS-Wall St climbs as inflation, jobless claims data ease rate worries",0.0,0.0,neutral
2023-04-13 00:00:00,AAPL,Why Apple Stock Popped on Thursday,0.0,0.0,neutral
2023-04-13 00:00:00,AAPL,Apple (AAPL) Plans to Shift Some MacBook Production to Thailand,0.0,0.0,neutral
2023-04-13 00:00:00,AAPL,US STOCKS-Wall St rallies to higher close as inflation data feeds Fed pause hopes,1.0,0.1,positive
2023-04-13 00:00:00,AAPL,Tools for Advisors: ETF Trading Tips in Earnings Season,0.0,0.0,neutral
2023-04-13 00:00:00,AAPL,Understanding ETF Distributions: An Investor’s Guide,0.0,0.0,neutral
2023-04-13 00:00:00,AAPL,"Company News for Apr 13, 2023",0.0,0.0,neutral
2023-04-13 00:00:00,AAPL,What's Up for Chip ETFs After Their Best Quarter Since 2020?,1.0,0.3,positive
2023-04-13 00:00:00,AAPL,Can AI answer your money questions? We put chatbots to the test,0.0,0.0,neutral
2023-04-13 00:00:00,AAPL,"Computer Sales Are Crashing and That's Bad News for Apple, Nvidia, and AMD",-1.0,0.1,negative
2023-04-13 00:00:00,AAPL,Should Engine No. 1 Transform 500 ETF (VOTE) Be on Your Investing Radar?,0.0,0.0,neutral
2023-04-13 00:00:00,AAPL,"Dow Movers: TRV, AAPL",0.0,0.0,neutral
2023-04-13 00:00:00,AAPL,Is WisdomTree U.S. LargeCap Dividend ETF (DLN) a Strong ETF Right Now?,1.0,0.1,positive
2023-04-13 00:00:00,AAPL,This Billionaire Investor Ran Circles Around Warren Buffett in 2022: These Are His Top 3 Stocks,0.5,0.5,positive
2023-04-13 00:00:00,AAPL,Guru Fundamental Report for AAPL - Warren Buffett,0.0,0.0,neutral
2023-04-13 00:00:00,AAPL,Apple to use 100% recycled cobalt in batteries by 2025,0.0,0.0,neutral
2023-04-13 00:00:00,AAPL,Apple Sets 2025 Target To Use 100% Recycled Cobalt In Batteries - Quick Facts,0.3333333333333333,0.5,positive
2023-04-13 00:00:00,AAPL,Apple to use only recycled cobalt in batteries by 2025,0.0,1.0,neutral
2023-04-13 00:00:00,AAPL,"2 Types of Corrections, 3 Ways to Navigate Them",0.0,0.0,neutral
2023-04-12 00:00:00,AAPL,Wall Street rises as inflation data soothes rate-hike jitters,1.0,0.1,positive
2023-04-12 00:00:00,AAPL,Apple in talks with suppliers to make MacBooks in Thailand - Nikkei,0.0,0.0,neutral
2023-04-12 00:00:00,AAPL,Meta Platforms (META) Unveils New Payment Aspect in WhatsApp,0.13636363636363635,0.45454545454545453,positive
2023-04-12 00:00:00,AAPL,Cirrus Logic slumps as analyst says Apple to abandon button design change,0.0,0.0,neutral
2023-04-12 00:00:00,AAPL,Buffett Reduces Taiwan Semiconductor Stake After This Happened,0.0,0.0,neutral
2023-04-12 00:00:00,AAPL,Alphabet (GOOGL) Adds New Features for YouTube Premium Users,0.13636363636363635,0.45454545454545453,positive
2023-04-12 00:00:00,AAPL,Mac Sales Could Continue to Slip. Should Apple Investors Brace Themselves?,0.0,0.0,neutral
2023-04-12 00:00:00,AAPL,Wall Street eyes higher open as inflation data eases rate-hike worries,1.0,0.1,positive
2023-04-12 00:00:00,AAPL,US STOCKS-Futures edge higher ahead of key inflation data,1.0,0.1,positive
2023-04-12 00:00:00,AAPL,Stock Market Sell-Off: Is Apple a Buy?,0.0,0.0,neutral
2023-04-12 00:00:00,AAPL,3 Web 3.0 Cryptos to Buy Right Now,0.2857142857142857,0.5357142857142857,positive
2023-04-12 00:00:00,AAPL,"Global PC Shipments Drop In Q1, Apple Lost More: IDC",-1.0,0.1,negative
2023-04-12 00:00:00,AAPL,A Bull Market Is Coming: 2 Reasons to Buy Apple's Stock,0.0,0.0,neutral
2023-04-12 00:00:00,AAPL,Investing in Tech Stocks? 1 New Data Point Suggests You Tread Lightly,0.2681818181818182,0.5772727272727273,positive
2023-04-12 00:00:00,AAPL,Should SPDR S&P 500 ETF (SPY) Be on Your Investing Radar?,0.0,0.0,neutral
2023-04-12 00:00:00,AAPL,Should Vanguard Large-Cap ETF (VV) Be on Your Investing Radar?,0.0,0.0,neutral
2023-04-11 00:00:00,AAPL,Apple To Open First Store In India Next Week,0.08333333333333333,0.27777777777777773,neutral
2023-04-11 00:00:00,AAPL,Time to Buy These 3 Next Gen Big Tech Companies?,0.0,0.05,neutral
2023-04-11 00:00:00,AAPL,"Technology Sector Update for 04/11/2023: GOOGL, GOOG, AAPL, MSFT, INTC",0.0,0.0,neutral
2023-04-11 00:00:00,AAPL,Apple to invest another $200 million in carbon removal fund,0.0,0.0,neutral
2023-04-11 00:00:00,AAPL,"Technology Sector Update for 04/11/2023: AAPL, MSFT, INTC",0.0,0.0,neutral
2023-04-11 00:00:00,AAPL,"Pinpoint 200% Gains in Six Months, Even in a Bear Market",1.0,0.1,positive
2023-04-11 00:00:00,AAPL,PC Shipments Plunge in Q1 on Weak Demand & Excess Inventory,-1.0,0.2,negative
2023-04-11 00:00:00,AAPL,Is PayPal Stock a Buy?,0.0,0.0,neutral
2023-04-11 00:00:00,AAPL,Apple Is (Probably) Making a Headset: Here's a Hidden Winner,1.0,0.1,positive
2023-04-11 00:00:00,AAPL,"Why Apple, Warner Bros. Discovery, and Amazon Are No-Brainer Buys Right Now",0.2857142857142857,0.5357142857142857,positive
2023-04-11 00:00:00,AAPL,Don't Expect Big Revenue Growth From Meta Platforms,1.0,0.1,positive
2023-04-11 00:00:00,AAPL,Guru Fundamental Report for AAPL - Warren Buffett,0.0,0.0,neutral
2023-04-11 00:00:00,AAPL,Should Vanguard S&P 500 Growth ETF (VOOG) Be on Your Investing Radar?,1.0,0.1,positive
2023-04-11 00:00:00,AAPL,Better AI Investment: Warren Buffett's Apple vs. Cathie Wood's Tesla,0.5,0.5,positive
2023-04-11 00:00:00,AAPL,Order Pizza On The Go With Domino's On Apple CarPlay,0.0,0.0,neutral
2023-04-11 00:00:00,AAPL,3 Great Foreign Companies to Invest in Right Now,0.32023809523809527,0.4702380952380952,positive
2023-04-11 00:00:00,AAPL,KKR buys stake in communications firm FGS Global,-0.1,0.2,neutral
2023-04-11 00:00:00,AAPL,"Taiwan's March exports lag forecast, outlook still under pressure",0.0,0.0,neutral
2023-04-11 00:00:00,AAPL,"Stock Market News for Apr 11, 2023",0.0,0.0,neutral
2023-04-10 00:00:00,AAPL,3 Dividend Stocks to Buy That Have a Loyal Customer Base,-0.23333333333333336,0.9166666666666667,negative
2023-04-10 00:00:00,AAPL,3 Stocks Warren Buffett Is Betting Big On Big-Time,0.0,0.1,neutral
2023-04-10 00:00:00,AAPL,"Notable Monday Option Activity: COST, MU, AAPL",0.5,0.5,positive
2023-04-10 00:00:00,AAPL,"After Hours Most Active for Apr 10, 2023 : F, VTRS, PAA, TAL, T, INTC, BAC, PCG, LI, MRO, AAPL, EMB",0.18333333333333335,0.55,positive
2023-04-10 00:00:00,AAPL,Several Apple services down for some users - Downdetector,-0.07777777777777778,0.14444444444444446,neutral
2023-04-10 00:00:00,AAPL,MORNING BID ASIA-China focus turns back to the macro,0.0,0.0,neutral
2023-04-10 00:00:00,AAPL,Apple (AAPL) Stock Sinks As Market Gains: What You Should Know,1.0,0.1,positive
2023-04-10 00:00:00,AAPL,Time to Spring-Clean...Your Stock Portfolio,0.0,0.0,neutral
2023-04-10 00:00:00,AAPL,US STOCKS-Wall Street drops as job gains fuel rate-hike worries,0.0,0.2,neutral
2023-04-10 00:00:00,AAPL,"Apple Music down for thousands, other services also affected",-0.14027777777777778,0.3319444444444445,negative
2023-04-10 00:00:00,AAPL,"Dow Movers: AAPL, CAT",0.0,0.0,neutral
2023-04-10 00:00:00,AAPL,US STOCKS-Futures muted after jobs data raises odds of more rate hikes,0.5,0.5,positive
2023-04-10 00:00:00,AAPL,3 Best Stocks to Buy in April for the Looming Recession,1.0,0.3,positive
2023-04-10 00:00:00,AAPL,What To Expect From Netflix's Q1 Earnings?,0.0,0.0,neutral
2023-04-10 00:00:00,AAPL,US STOCKS-Wall St set for lower open as jobs report stokes rate-hike worries,0.0,0.5,neutral
2023-04-10 00:00:00,AAPL,"Global PC shipments slide in Q1, Apple takes biggest hit - IDC",0.0,0.0,neutral
2023-04-10 00:00:00,AAPL,ChatGPT Could Break the iOS/Android Duopoly,0.0,0.0,neutral
2023-04-10 00:00:00,AAPL,Warren Buffett Has Gained Over $177 Billion From Only 4 Stocks,1.0,0.1,positive
2023-04-10 00:00:00,AAPL,Should Vanguard S&P 500 ETF (VOO) Be on Your Investing Radar?,0.0,0.0,neutral
2023-04-10 00:00:00,AAPL,3 Growth Stocks You Should Invest in Now,1.0,0.1,positive
2023-04-10 00:00:00,AAPL,US STOCKS-Futures muted after jobs data raises odds of more rate hikes,0.5,0.5,positive
2023-04-10 00:00:00,AAPL,Should Fidelity Nasdaq Composite Index ETF (ONEQ) Be on Your Investing Radar?,0.0,0.0,neutral
2023-04-10 00:00:00,AAPL,Guru Fundamental Report for AAPL - Warren Buffett,0.0,0.0,neutral
2023-04-09 00:00:00,AAPL,A Bull Market Is Coming: 1 FAANG Stock-Heavy Index Fund to Buy Now,0.0,0.0,neutral
2023-04-09 00:00:00,AAPL,MORNING BID ASIA-China-Taiwan tensions loom ever larger,0.0,0.5,neutral
2023-04-09 00:00:00,AAPL,3 Dividend Stocks Billionaires Seem to Love,0.5,0.6,positive
2023-04-09 00:00:00,AAPL,3 Stocks That Have the Most to Gain From an AI Pause,1.0,0.1,positive
2023-04-09 00:00:00,AAPL,Why Has Warren Buffett Invested 44% of His Portfolio in This 1 Stock?,0.0,0.0,neutral
2023-04-09 00:00:00,AAPL,Foxconn plans $800 mln investment in southern Taiwan,0.0,0.0,neutral
2023-04-08 00:00:00,AAPL,Here's How Amazon Could Become a $5 Trillion Stock Within a Decade,0.0,0.0,neutral
2023-04-08 00:00:00,AAPL,Apple Makes Up Nearly Half of Warren Buffett's Portfolio. Here's Why He Should Consider Selling Some,-0.16666666666666666,0.16666666666666666,negative
2023-04-08 00:00:00,AAPL,Worried About Elon's AI Pause? 3 Top Stocks You Can Buy That Wouldn't Be Impacted,0.5,0.5,positive
2023-04-08 00:00:00,AAPL,ChatGPT Exposes Siri and Alexa's Biggest Flaws,0.0,0.0,neutral
2023-04-08 00:00:00,AAPL,"This Warren Buffett ETF Could Take You From $5,000 to $87,000 With Next to No Effort",0.0,0.0,neutral
2023-04-08 00:00:00,AAPL,"Baidu sues Apple, app developers over fake Ernie bot apps",-0.5,1.0,negative
2023-04-07 00:00:00,AAPL,Guru Fundamental Report for AAPL - Warren Buffett,0.0,0.0,neutral
2023-04-07 00:00:00,AAPL,Stock Split Watch: Is Costco Next?,0.0,0.0,neutral
2023-04-06 00:00:00,AAPL,Guru Fundamental Report for AAPL - Warren Buffett,0.0,0.0,neutral
2023-04-06 00:00:00,AAPL,3 Cryptos That Day Traders Love Right Now,0.39285714285714285,0.5678571428571428,positive
2023-04-06 00:00:00,AAPL,The 3 Biggest Risks Facing GOOG Stock Today,-1.0,0.1,negative
2023-04-06 00:00:00,AAPL,"After Hours Most Active for Apr 6, 2023 : S, AAPL, ASND, SCHW, LI, COTY, AMZN, QQQ, XOM, MSFT, T, CVX",0.038888888888888896,0.7000000000000001,neutral
2023-04-06 00:00:00,AAPL,Banking Crisis: Implications for ETF Investors,0.0,0.0,neutral
2023-04-06 00:00:00,AAPL,The 3 Best Ways to Build Generational Wealth In the Stock Market,1.0,0.3,positive
2023-04-06 00:00:00,AAPL,"US STOCKS-S&P, Nasdaq reverse early declines to edge higher; monthly jobs data eyed",0.0,0.2,neutral
2023-04-06 00:00:00,AAPL,US STOCKS-Wall St falls as recession fears rise after jobless claims data,0.0,0.2,neutral
2023-04-06 00:00:00,AAPL,US STOCKS-Wall St set to open lower as jobless claims data fans slowdown fears,0.0,0.5,neutral
2023-04-06 00:00:00,AAPL,1 Valuable Lesson the SVB Collapse Taught Growth Investors,1.0,0.1,positive
2023-04-06 00:00:00,AAPL,Netflix (NFLX) Expands International Content With Stolen,0.0,0.0,neutral
2023-04-06 00:00:00,AAPL,3 Reasons Why Apple’s 30% Rally Has Legs,1.0,0.1,positive
2023-04-06 00:00:00,AAPL,US STOCKS-Futures muted as focus shifts to jobs data amid recession fears,0.0,0.0,neutral
2023-04-06 00:00:00,AAPL,"AAPL, AMZN, META: Will the Rally in Big Tech Stocks Hold?",1.0,0.1,positive
2023-04-06 00:00:00,AAPL,US STOCKS-Futures muted with all eyes on jobs data amid recession fears,0.0,0.0,neutral
2023-04-06 00:00:00,AAPL,Is Apple's Headset a Dud Before It Arrives?,0.0,0.0,neutral
2023-04-06 00:00:00,AAPL,7 Dividend-Paying Large-Cap Stocks to Buy in April,0.0,0.0,neutral
2023-04-06 00:00:00,AAPL,What's Next For Tesla After Mixed Q1 Delivery Report?,0.0,0.125,neutral
2023-04-06 00:00:00,AAPL,What's New With Apple Stock?,0.13636363636363635,0.45454545454545453,positive
2023-04-06 00:00:00,AAPL,Should WisdomTree U.S. Total Dividend ETF (DTD) Be on Your Investing Radar?,0.0,0.75,neutral
2023-04-06 00:00:00,AAPL,How to Find Undervalued Stocks? Here's Where I Start.,0.0,0.0,neutral
2023-04-06 00:00:00,AAPL,Wall Street Says 3 of Q1's Hottest Tech Stocks Are Done Rallying... at Least for Now,1.0,0.1,positive
2023-04-06 00:00:00,AAPL,Apple says 'Hello Mumbai' at first India store launch,0.25,0.3333333333333333,positive
2023-04-06 00:00:00,AAPL,GRAPHIC-World stocks survive banking turmoil - but for how long?,-0.05,0.4,neutral
2023-04-05 00:00:00,AAPL,Invest with (or Against) Jim Cramer with These New ETFs,1.0,0.1,positive
2023-04-05 00:00:00,AAPL,US STOCKS-S&P 500 ends lower as recession fears take center stage,-0.1,0.1,neutral
2023-04-05 00:00:00,AAPL,These Stocks Are Warren Buffett's 3 Largest AI-Fueled Investments,0.0,0.0,neutral
2023-04-05 00:00:00,AAPL,Why Apple Stock Was Down on Wednesday,-0.15555555555555556,0.2888888888888889,negative
2023-04-05 00:00:00,AAPL,"Unusual Call Option Trade in Apple (AAPL) Worth $5,820.00K",0.25,0.55,positive
2023-04-05 00:00:00,AAPL,B of A Securities Maintains Apple (AAPL) Neutral Recommendation,0.0,0.0,neutral
2023-04-05 00:00:00,AAPL,"After Hours Most Active for Apr 5, 2023 : SWN, KDP, LI, KBWB, CCL, GENI, ADT, AAPL, AMZN, AMCR, HAYW, TMUS",0.18333333333333335,0.55,positive
2023-04-05 00:00:00,AAPL,Why Universal Display Stock Gained 14% Last Month,1.0,0.1,positive
2023-04-05 00:00:00,AAPL,"Unusual Call Option Trade in Apple (AAPL) Worth $13,154.10K",0.25,0.55,positive
2023-04-05 00:00:00,AAPL,US STOCKS-S&P 500 ends lower as recession fears take center stage,-0.1,0.1,neutral
2023-04-05 00:00:00,AAPL,Play AI’s “iPhone Moment” in Cloud Computing ETF WCLD,0.0,0.0,neutral
2023-04-05 00:00:00,AAPL,Regional Banks vs. Tech: What Lies Ahead?,0.0,0.0,neutral
2023-04-05 00:00:00,AAPL,US STOCKS-S&P 500 drops as recession fears take center stage,-1.0,0.1,negative
2023-04-05 00:00:00,AAPL,The Surprising Reason the Dow Jones Industrials Rose in the First Quarter of 2023,0.5166666666666666,0.5944444444444444,positive
2023-04-05 00:00:00,AAPL,"Apple, Intel, and Nvidia Stock: Breaking Down the Latest Semiconductor Updates",0.17222222222222222,0.5944444444444444,positive
2023-04-05 00:00:00,AAPL,"Technology Sector Update for 04/05/2023: AAPL, NNDM, SSYS, PLUS, WATT",0.0,0.0,neutral
2023-04-05 00:00:00,AAPL,Is Most-Watched Stock Apple Inc. (AAPL) Worth Betting on Now?,0.3,0.1,positive
2023-04-05 00:00:00,AAPL,Is FlexShares Morningstar U.S. Market Factor Tilt ETF (TILT) a Strong ETF Right Now?,1.0,0.1,positive
2023-04-05 00:00:00,AAPL,"SGH Bottomed, But Can It Reverse And Move Higher?",1.0,0.1,positive
2023-04-05 00:00:00,AAPL,Apple says more suppliers committing to renewable energy,0.5,0.5,positive
2023-04-05 00:00:00,AAPL,Chart of the Week: Advisors Looking to Prevent Losing Q1 Gains,1.0,0.1,positive
2023-04-05 00:00:00,AAPL,Is Pinterest Showing Signs of an Improving Ad Market?,1.0,0.1,positive
2023-04-05 00:00:00,AAPL,3 Thrilling AI Stocks for Aggressive Investors to Buy,0.25,1.0,positive
2023-04-05 00:00:00,AAPL,Should Invesco FTSE RAFI US 1000 ETF (PRF) Be on Your Investing Radar?,0.0,0.0,neutral
2023-04-05 00:00:00,AAPL,Apple Stock: Bear vs. Bull,0.0,0.0,neutral
2023-04-05 00:00:00,AAPL,Foxconn Q1 sales rise 3.9% y/y,1.0,0.1,positive
2023-04-05 00:00:00,AAPL,US STOCKS-Futures fall as investors await key economic data amid recession fears,-1.0,0.1,negative
2023-04-05 00:00:00,AAPL,German antitrust regulator opens door for curbs on Apple,0.0,0.0,neutral
2023-04-05 00:00:00,AAPL,A Stock That Could Go Up 10x in a Decade,0.0,0.0,neutral
2023-04-05 00:00:00,AAPL,Better Growth Stock: Apple vs. Nvidia,1.0,0.1,positive
2023-04-05 00:00:00,AAPL,"Foxconn Q1 sales edge up, but Q2 outlook poor",-0.4,0.6,negative
2023-04-04 00:00:00,AAPL,Wall Street Analysts Think Apple (AAPL) Is a Good Investment: Is It?,0.7,0.6000000000000001,positive
2023-04-04 00:00:00,AAPL,Macy’s Gets Upgrade From JP Morgan On Renewed Confidence,1.0,0.1,positive
2023-04-04 00:00:00,AAPL,Foxconn founder Gou says he will seek Taiwan presidency,0.0,0.0,neutral
2023-04-04 00:00:00,AAPL,"Unusual Call Option Trade in Apple (AAPL) Worth $1,151.49K",0.25,0.55,positive
2023-04-04 00:00:00,AAPL,"After Hours Most Active for Apr 4, 2023 : PACW, VICI, ATVI, QQQ, IBN, IOVA, AAPL, PARA, UBER, CCL, OWL, LBRT",0.18333333333333335,0.55,positive
2023-04-04 00:00:00,AAPL,"Technology Sector Update for 04/04/2023: AAPL, VORB, AI, INTC, TSEM, SIMO, MXL",0.0,0.0,neutral
2023-04-04 00:00:00,AAPL,The 3 Best Defensive Stocks to Buy in April 2023,1.0,0.3,positive
2023-04-04 00:00:00,AAPL,Best & Worst Performing ETF Areas of Q1 2023,0.0,0.65,neutral
2023-04-04 00:00:00,AAPL,Land a Knockout Punch Against the Bear Market RIGHT NOW!,1.0,0.1,positive
2023-04-04 00:00:00,AAPL,Apple Music trademark application blocked by U.S. appeals court,0.0,0.0,neutral
2023-04-04 00:00:00,AAPL,The 7 Best Forever Stocks to Buy for April 2023,1.0,0.3,positive
2023-04-04 00:00:00,AAPL,COLUMN-Is it time to embrace Congo's artisanal cobalt miners? Andy Home,0.0,0.0,neutral
2023-04-04 00:00:00,AAPL,PayPal Near Its Cheapest Valuation Over the Past 10 Years -- Is It a Buy?,-0.075,0.325,neutral
2023-04-04 00:00:00,AAPL,Bill Gates says calls to pause AI won't 'solve challenges',0.0,0.0,neutral
2023-04-04 00:00:00,AAPL,Why It’s Buyer Beware When It Comes to AI Mania and NVDA Stock,0.0,0.0,neutral
2023-04-04 00:00:00,AAPL,Should iShares Russell 1000 ETF (IWB) Be on Your Investing Radar?,0.0,0.0,neutral
2023-04-04 00:00:00,AAPL,Apple Stock Looks Like a Tasty Holding for Summer,0.0,0.0,neutral
2023-04-04 00:00:00,AAPL,2024 Will Be the Make-or-Break Year for Meta's Reality Labs,0.0,0.0,neutral
2023-04-04 00:00:00,AAPL,"The Zacks Analyst Blog Highlights Apple, Meta Platforms, Visa, United Parcel Service and Caterpillar",1.0,0.1,positive
2023-04-04 00:00:00,AAPL,3 Stocks With Solid EPS Estimates & Charts For The Tech Rebound,0.0,0.1,neutral
2023-04-04 00:00:00,AAPL,Guru Fundamental Report for AAPL - Warren Buffett,0.0,0.0,neutral
2023-04-03 00:00:00,AAPL,"Top Research Reports for Apple, Meta Platforms & Visa",0.5,0.5,positive
2023-04-03 00:00:00,AAPL,"Company News for Apr 3, 2023",0.0,0.0,neutral
2023-04-03 00:00:00,AAPL,Energy Companies Are Rewarding Shareholders With Share Buybacks,0.5,1.0,positive
2023-04-03 00:00:00,AAPL,Dow Analyst Moves: AAPL,0.0,0.0,neutral
2023-04-03 00:00:00,AAPL,"In the News: Merger Monday, WYNNing Macau Numbers, & Surprise Oil Cuts",1.0,0.1,positive
2023-04-03 00:00:00,AAPL,3 Reasons Apple Could Buy Disney and 3 Reasons It's a Terrible Idea,-1.0,1.0,negative
2023-04-03 00:00:00,AAPL,"After Hours Most Active for Apr 3, 2023 : PSCE, BAC, WFC, CSCO, CMCSA, QQQ, AAPL, JPM, HLN, HBAN, BFLY, C",0.18333333333333335,0.55,positive
2023-04-03 00:00:00,AAPL,What Lies Ahead for Tech Stocks & ETFs After a Blockbuster Quarter,0.0,0.0,neutral
2023-04-03 00:00:00,AAPL,Apple (AAPL) Outpaces Stock Market Gains: What You Should Know,1.0,0.1,positive
2023-04-03 00:00:00,AAPL,Why Apple Stock Was Up 11% in March,0.0,0.0,neutral
2023-04-03 00:00:00,AAPL,"US STOCKS-S&P 500, Nasdaq set to open lower as oil output cut stokes inflation worries",0.0,0.5,neutral
2023-04-03 00:00:00,AAPL,"US STOCKS-S&P, Nasdaq futures fall on inflation worries after OPEC+ output cut",-1.0,0.1,negative
2023-04-03 00:00:00,AAPL,"Why Apple, Walt Disney, and Take-Two Interactive Are No-Brainer Buys Right Now",0.2857142857142857,0.5357142857142857,positive
2023-04-03 00:00:00,AAPL,Is it Time to Take a Bite Out of Apple Stock?,0.0,0.0,neutral
2023-04-03 00:00:00,AAPL,Should SPDR Portfolio S&P 500 ETF (SPLG) Be on Your Investing Radar?,0.0,0.0,neutral
2023-04-03 00:00:00,AAPL,Is iShares ESG Aware MSCI USA ETF (ESGU) a Strong ETF Right Now?,1.0,0.1,positive
2023-04-03 00:00:00,AAPL,Guru Fundamental Report for AAPL - Warren Buffett,0.0,0.0,neutral
2023-04-03 00:00:00,AAPL,Zacks Industry Outlook Highlights Apple and HP,1.0,0.1,positive
2023-04-03 00:00:00,AAPL,"Qualcomm Is The Higher Reward, For Higher Risk Takers",0.0,0.2,neutral
2023-04-03 00:00:00,AAPL,"US STOCKS-S&P, Nasdaq futures slip as oil output cut reignites inflation worries",0.0,0.0,neutral
2023-04-03 00:00:00,AAPL,"Intel Promised A Comeback, And It Delivered",0.0,0.0,neutral
2023-04-03 00:00:00,AAPL,Better Buy: Roku vs. Netflix,0.5,0.5,positive
2023-04-02 00:00:00,AAPL,3 Growth Stocks That Are Leading the Innovation Race,1.0,0.1,positive
2023-04-02 00:00:00,AAPL,The 7 Best Tech ETFs to Buy for Diversified Exposure,1.0,0.3,positive
2023-04-02 00:00:00,AAPL,3 Tech Stocks I Love Right Now,0.39285714285714285,0.5678571428571428,positive
2023-04-01 00:00:00,AAPL,3 Robinhood Stocks to Buy Right Now,0.2857142857142857,0.5357142857142857,positive
2023-04-01 00:00:00,AAPL,Why You Should Buy Apple Stock,0.0,0.0,neutral
2023-04-01 00:00:00,AAPL,My 10 Best Dividend Stocks to Buy Now in April,1.0,0.3,positive
2023-03-31 00:00:00,AAPL,Is WisdomTree U.S. Total Dividend ETF (DTD) a Strong ETF Right Now?,1.0,0.1,positive
2023-03-31 00:00:00,AAPL,US STOCKS-Wall St climbs as inflation data boosts softer Fed policy hopes,1.0,0.1,positive
2023-03-31 00:00:00,AAPL,"US STOCKS-Nasdaq posts best qtr since 2020, latest inflation data a boost",1.0,0.1,positive
2023-03-31 00:00:00,AAPL,Are Big Tech Stocks the Next Safe Haven Investment?,0.16666666666666666,0.19999999999999998,positive
2023-03-31 00:00:00,AAPL,Better VR Stock: AMD vs. Apple,0.5,0.5,positive
2023-03-31 00:00:00,AAPL,US STOCKS-S&P 500 set for upbeat end to quarter amid softer Fed policy hopes,1.0,0.1,positive
2023-03-31 00:00:00,AAPL,2 Stocks to Watch From the Prospering Computer Industry,0.0,0.0,neutral
2023-03-31 00:00:00,AAPL,Apple wins appeal against UK's decision to investigate its mobile browser,1.0,0.2,positive
2023-03-31 00:00:00,AAPL,Top and Flop ETFs of March,0.5,0.5,positive
2023-03-31 00:00:00,AAPL,Can the Nasdaq's Q1 Outperformance Extend to Q2?,1.0,0.1,positive
2023-03-31 00:00:00,AAPL,GRAPHIC-Markets in Q1: Moving fast and breaking things,0.2,0.6,positive
2023-03-31 00:00:00,AAPL,"Noteworthy Friday Option Activity: AAPL, LILAK, TH",0.0,0.0,neutral
