date,ticker,headline,polarity,subjectivity,sentiment
2023-08-24 00:00:00,AAPL,"US STOCKS-Wall St falls as Nvidia boost fades, caution sets in ahead of Powell speech",0.0,0.2,neutral
2023-08-24 00:00:00,AAPL,These Are the ONLY 3 Blue-Chip Stocks to Consider in August 2023,0.0,1.0,neutral
2023-08-24 00:00:00,AAPL,3 Vanguard ETFs That Could Help You Retire a Millionaire,0.0,0.0,neutral
2023-08-24 00:00:00,AAPL,The Ultimate Warren Buffett Stock to Buy Right Now,0.14285714285714285,0.7678571428571428,positive
2023-08-24 00:00:00,AAPL,"US STOCKS-Wall St gains on Nvidia boost, caution sets in ahead of Powell speech",1.0,0.2,positive
2023-08-24 00:00:00,AAPL,ROKU Users in Canada Can Now Access CBC Gem on Its Platform,0.0,0.0,neutral
2023-08-24 00:00:00,AAPL,3 Dividend Stocks to Buy and Hold Until You Retire,0.0,0.0,neutral
2023-08-24 00:00:00,AAPL,Guru Fundamental Report for AAPL - Warren Buffett,0.0,0.0,neutral
2023-08-24 00:00:00,AAPL,Stock Market Sell-Off: Where to Invest $500 Right Now,0.2857142857142857,0.5357142857142857,positive
2023-08-24 00:00:00,AAPL,2 Dividend-Paying Tech Stocks to Buy and Hold for 10 Years,0.0,0.0,neutral
2023-08-24 00:00:00,AAPL,Is WisdomTree U.S. Quality Dividend Growth ETF (DGRW) a Strong ETF Right Now?,1.0,0.2,positive
2023-08-24 00:00:00,AAPL,3 Artificial Intelligence (AI) Stocks With More Potential Than Any Cryptocurrency,-0.033333333333333326,0.8333333333333334,neutral
2023-08-24 00:00:00,AAPL,1 Pricey FAANG Stock Billionaires Are Buying Hand Over Fist and 2 They're Surprisingly Selling,0.7,0.5,positive
2023-08-24 00:00:00,AAPL,"Zacks Investment Ideas feature highlights: Apple, Nasdaq 100 Index ETF, Super Micro Computer and S&P 500 Index ETF",1.0,0.1,positive
2023-08-24 00:00:00,AAPL,"This Incredibly Cheap Stock Is Up 53% in 2023, and It Is Still a Screaming Buy",0.4,0.7,positive
2023-08-23 00:00:00,AAPL,Netflix (NFLX) Expands Footprint in India With New Partnership,0.13636363636363635,0.45454545454545453,positive
2023-08-23 00:00:00,AAPL,These Are the ONLY 3 Dow Stocks to Consider in August 2023,0.0,1.0,neutral
2023-08-23 00:00:00,AAPL,"Amid Slowing Growth, Apple's Ace in the Hole Is More Important Than Ever",1.0,0.2,positive
2023-08-23 00:00:00,AAPL,1 Supercharged Growth Stock That's a Shoo-in to Join Apple and Microsoft in the $2 Trillion Club by 2028,1.0,0.1,positive
2023-08-23 00:00:00,AAPL,7 Best AI Mutual Funds (and ETFs) to Sweep the AI Craze,1.0,0.3,positive
2023-08-23 00:00:00,AAPL,"Dow Movers: NKE, MRK",0.0,0.0,neutral
2023-08-23 00:00:00,AAPL,10 Lessons from 2 Decades of Investing Experience,0.0,0.0,neutral
2023-08-23 00:00:00,AAPL,3 Blue Chip Stocks To Watch In The Stock Market Today,0.0,0.1,neutral
2023-08-23 00:00:00,AAPL,Should You Buy Qualcomm on the Dip?,0.0,0.0,neutral
2023-08-23 00:00:00,AAPL,"US STOCKS-Indexes jump, AI chip maker Nvidia up ahead of results",1.0,0.1,positive
2023-08-23 00:00:00,AAPL,3 Wide-Moat Stocks That Warren Buffett Loves,0.0,0.0,neutral
2023-08-23 00:00:00,AAPL,Indexes end sharply higher; AI chip maker Nvidia up ahead of results,1.0,0.1,positive
2023-08-23 00:00:00,AAPL,"NVIDIA Posts Giant Q2 Beats, Guides Way Higher",1.0,0.2,positive
2023-08-23 00:00:00,AAPL,Apple endorses California bill on 'Right to Repair',0.2857142857142857,0.5357142857142857,positive
2023-08-23 00:00:00,AAPL,Is Apple the Best Buyer for ESPN?,1.0,0.3,positive
2023-08-23 00:00:00,AAPL,Don’t Hold Your Breath: 7 High-Profile Stocks With Ridiculous Price Targets,1.0,0.1,positive
2023-08-23 00:00:00,AAPL,AAPL Factor-Based Stock Analysis - Warren Buffett,0.0,0.0,neutral
2023-08-23 00:00:00,AAPL,How to Buy OpenAI Stock: A Guide,0.0,0.0,neutral
2023-08-23 00:00:00,AAPL,ANALYSIS-Arm's China relationship complicates IPO,0.0,0.0,neutral
2023-08-23 00:00:00,AAPL,Should WisdomTree U.S. LargeCap ETF (EPS) Be on Your Investing Radar?,0.0,0.0,neutral
2023-08-23 00:00:00,AAPL,"Got $5,000? 3 Tech Stocks to Buy and Hold for the Long Term.",-0.05,0.4,neutral
2023-08-23 00:00:00,AAPL,1 Thing Investors Should Know About Apple's Revenue in 2023,0.0,0.0,neutral
2023-08-23 00:00:00,AAPL,Trading Alert: Long Call Butterfly Screener Results For August 23rd,-0.05,0.4,neutral
2023-08-23 00:00:00,AAPL,Nvidia shares up on hopes of strong results powering another AI rally,1.0,0.2,positive
2023-08-23 00:00:00,AAPL,Is iShares ESG Aware MSCI USA ETF (ESGU) a Strong ETF Right Now?,1.0,0.1,positive
2023-08-23 00:00:00,AAPL,2 Tech Stocks You Can Buy and Hold for the Next Decade,0.0,0.0,neutral
2023-08-23 00:00:00,AAPL,Is Vanguard Dividend Appreciation ETF (VIG) a Strong ETF Right Now?,1.0,0.1,positive
2023-08-23 00:00:00,AAPL,US STOCKS-Futures gain with all eyes on high-stakes Nvidia results,1.0,0.2,positive
2023-08-23 00:00:00,AAPL,Can Nvidia Do It Again?,1.0,0.1,positive
2023-08-23 00:00:00,AAPL,ANALYSIS-Investors look to AI-darling Nvidia's earnings as US stocks rally wobbles,1.0,0.1,positive
2023-08-22 00:00:00,AAPL,Apple’s Buyback Blunder: 3 Reasons It’s Not a Win for AAPL Shareholders,1.0,0.1,positive
2023-08-22 00:00:00,AAPL,2 Stocks Warren Buffett Is Loving (and One He Let Go),0.6,0.95,positive
2023-08-22 00:00:00,AAPL,ANALYSIS-Arm's clients turn IPO into tug of war for chip influence,0.0,0.0,neutral
2023-08-22 00:00:00,AAPL,QQQ vs. RSP : Which Is the Better ETF Investment Now?,0.5,0.5,positive
2023-08-22 00:00:00,AAPL,Is SPDR MSCI USA StrategicFactors ETF (QUS) a Strong ETF Right Now?,1.0,0.1,positive
2023-08-22 00:00:00,AAPL,Should Invesco FTSE RAFI US 1000 ETF (PRF) Be on Your Investing Radar?,0.0,0.0,neutral
2023-08-22 00:00:00,AAPL,3 ETFs to Invest Like Warren Buffett,0.0,0.0,neutral
2023-08-22 00:00:00,AAPL,Buying These 3 Stocks Could Be the Smartest Investing Move You Ever Make,0.0,0.0,neutral
2023-08-22 00:00:00,AAPL,Should SPDR Portfolio S&P 500 Growth ETF (SPYG) Be on Your Investing Radar?,1.0,0.1,positive
2023-08-22 00:00:00,AAPL,AAPL Quantitative Stock Analysis - Warren Buffett,0.0,0.0,neutral
2023-08-22 00:00:00,AAPL,EXCLUSIVE-Rare earths magnet firms turn to Vietnam in China hedge,0.0,0.0,neutral
2023-08-22 00:00:00,AAPL,Big Tech Drives Adage Capital's June Quarter Gains as Boston Fund Cut Midwest Bank Positions,1.0,0.1,positive
2023-08-22 00:00:00,AAPL,"Stock Market News for Aug 22, 2023",0.0,0.0,neutral
2023-08-22 00:00:00,AAPL,ANALYSIS-Arm's clients turn IPO into tug of war for chip influence,0.0,0.0,neutral
2023-08-22 00:00:00,AAPL,2 Stocks to Invest in Virtual Reality,0.0,0.0,neutral
2023-08-21 00:00:00,AAPL,Tesla shares gain as Baird Equity adds stock to 'best ideas' list,1.0,0.1,positive
2023-08-21 00:00:00,AAPL,Apple and Spotify: 2 AI Stock Plays in Music Streaming,0.0,0.0,neutral
2023-08-21 00:00:00,AAPL,Lawsuit claiming Apple Watch sensor exhibits 'racial bias' is dismissed,-1.0,0.2,negative
2023-08-21 00:00:00,AAPL,QQQ vs. RSP : Which Is the Better ETF Investment Now?,0.5,0.5,positive
2023-08-21 00:00:00,AAPL,Apple and Spotify: 2 Music Streaming AI Stocks to Scoop Up in August,0.0,0.0,neutral
2023-08-21 00:00:00,AAPL,"Unusual Call Option Trade in Apple (AAPL) Worth $1,699.45K",0.25,0.55,positive
2023-08-21 00:00:00,AAPL,Berkshire's Johns Manville unit to face revived antitrust lawsuit,-1.0,0.1,negative
2023-08-21 00:00:00,AAPL,Option Volatility and Earnings Report for August 21 - 25,0.0,0.0,neutral
2023-08-21 00:00:00,AAPL,It's Time to Load Up on Apple Stock,0.0,0.0,neutral
2023-08-21 00:00:00,AAPL,Apple Inc. (AAPL) is Attracting Investor Attention: Here is What You Should Know,0.0,0.0,neutral
2023-08-21 00:00:00,AAPL,Will Apple's iPhone 15 Launch & AI Innovations Spark New Uptrend?,0.13636363636363635,0.45454545454545453,positive
2023-08-21 00:00:00,AAPL,The 3 Most Undervalued Manufacturing Stocks to Buy Now: August 2023,0.5,0.5,positive
2023-08-21 00:00:00,AAPL,Taiwan July export orders drop for 11th month; Q3 outlook better on Q2,-1.0,0.1,negative
2023-08-21 00:00:00,AAPL,Best Dividend Stocks: Apple Stock vs. Microsoft Stock,1.0,0.3,positive
2023-08-21 00:00:00,AAPL,"The Zacks Analyst Blog Highlights Apple, NVIDIA, Bank of America, Nike and Prologis",1.0,0.1,positive
2023-08-20 00:00:00,AAPL,3 Tech Stocks With More Potential Than Any Cryptocurrency,0.25,0.75,positive
2023-08-20 00:00:00,AAPL,3 Tech Stocks With More Potential Than Any Cryptocurrency,0.25,0.75,positive
2023-08-20 00:00:00,AAPL,"Should Apple Buy ESPN From Disney? Wall Street Analyst Dan Ives Thinks It's a ""No-Brainer""",0.0,0.0,neutral
2023-08-20 00:00:00,AAPL,"If You Invested $1,000 in Berkshire Hathaway a Decade Ago, This Is How Much You Would Have Today",0.2,0.2,positive
2023-08-20 00:00:00,AAPL,3 Top Stocks To Buy if There Is a Market Pullback,0.5,0.5,positive
2023-08-19 00:00:00,AAPL,These 3 Tech Stocks Are Building the Future,0.0,0.125,neutral
2023-08-19 00:00:00,AAPL,Elon Musk says X will strip ability to block accounts,0.0,0.0,neutral
2023-08-19 00:00:00,AAPL,Opinion: These Will Be the 5 Largest Stocks by 2030,0.0,0.0,neutral
2023-08-19 00:00:00,AAPL,2 Stocks Down 55% and 80% to Buy Right Now,0.06507936507936507,0.4123015873015873,neutral
2023-08-19 00:00:00,AAPL,Almost Half of Warren Buffett's $354 Billion Portfolio Is Invested in Only 1 Stock,-0.08333333333333333,0.5833333333333334,neutral
2023-08-19 00:00:00,AAPL,FTHI ETF: Why Its 8%+ Dividend Yield May Not be Good Enough,0.35,0.55,positive
2023-08-18 00:00:00,AAPL,"US STOCKS-Wall St cuts losses as energy, defensive sectors counter megacap declines",-1.0,0.2,negative
2023-08-18 00:00:00,AAPL,"DBMF Holds Steady While Tech, Agg Slip in August",0.16666666666666666,0.5,positive
2023-08-18 00:00:00,AAPL,1 Top Tech Stock to Buy During a Recession,0.5,0.5,positive
2023-08-18 00:00:00,AAPL,"After Hours Most Active for Aug 18, 2023 : MRCY, KMI, RLJ, CHK, EGHT, JNJ, AVPT, TSN, AAPL, PANW, D, WEAV",0.18333333333333335,0.55,positive
2023-08-18 00:00:00,AAPL,"S&P 500 ends near flat as energy, defensive sectors counter megacap declines",-1.0,0.1,negative
2023-08-18 00:00:00,AAPL,Netflix Stock (NASDAQ:NFLX): The Growth Phase is Over. Time to Sell?,1.0,0.1,positive
2023-08-18 00:00:00,AAPL,"US STOCKS-Wall St mixed as energy, defensive sectors counter megacap declines",-1.0,0.1,negative
2023-08-18 00:00:00,AAPL,4 Sectors Warren Buffett Binges On: ETFs in Focus,0.0,0.0,neutral
2023-08-18 00:00:00,AAPL,"Top Stock Reports for Apple, NVIDIA & Bank of America",0.5,0.5,positive
2023-08-18 00:00:00,AAPL,US STOCKS-Wall St slides as megacap growth stocks drag on rate jitters,1.0,0.1,positive
2023-08-18 00:00:00,AAPL,1.4 Trillion Reasons to Like PayPal Stock,0.0,0.0,neutral
2023-08-18 00:00:00,AAPL,US STOCKS-Wall St eyes lower open on jitters over higher-for-longer rates,1.0,0.1,positive
2023-08-18 00:00:00,AAPL,3 Top Tech Stocks to Buy Right Now,0.39285714285714285,0.5178571428571428,positive
2023-08-18 00:00:00,AAPL,Warren Buffett Detailed Fundamental Analysis - AAPL,0.4,0.75,positive
2023-08-18 00:00:00,AAPL,3 Computer Stocks To Buy On The PC Pullback,0.0,0.0,neutral
2023-08-18 00:00:00,AAPL,This Tech Giant Stands Strong Amidst Recent Selloff,1.0,0.1,positive
2023-08-18 00:00:00,AAPL,Should WisdomTree U.S. Total Dividend ETF (DTD) Be on Your Investing Radar?,0.0,0.75,neutral
2023-08-18 00:00:00,AAPL,Warren Buffett and Michael Burry Just Sent Wall Street a Grim Warning: The Stock Market May Be Headed Lower,-1.0,0.1,negative
2023-08-18 00:00:00,AAPL,78% of Warren Buffett's $360 Billion Portfolio Is Invested in Only 6 Stocks,0.0,1.0,neutral
2023-08-18 00:00:00,AAPL,"Norway fund wants more women on boards, concerned about excessive CEO pay",-1.0,0.1,negative
2023-08-17 00:00:00,AAPL,"Noteworthy ETF Inflows: IVV, AAPL, MSFT, AMZN",0.0,0.0,neutral
2023-08-17 00:00:00,AAPL,The 3 Most Undervalued Small-Cap Stocks to Buy Now: August 2023,0.5,0.5,positive
2023-08-17 00:00:00,AAPL,Trillion-Dollar Trio: These 3 Super Growth Stocks Will Dominate the Market by 2035,1.0,0.1,positive
2023-08-17 00:00:00,AAPL,Warren Buffett donates $27 mln Berkshire stock,0.0,0.0,neutral
2023-08-17 00:00:00,AAPL,"Striking writers take antitrust aim at Disney, Amazon, Netflix",0.5,1.0,positive
2023-08-17 00:00:00,AAPL,"Noteworthy Thursday Option Activity: AAPL, MMM, COIN",0.0,0.0,neutral
2023-08-17 00:00:00,AAPL,Thursday's ETF with Unusual Volume: DJD,0.2,1.0,positive
2023-08-17 00:00:00,AAPL,"US STOCKS-Wall Street dips on healthcare losses, interest rate jitters",-1.0,0.1,negative
2023-08-17 00:00:00,AAPL,3 Tech Stocks You’ll Regret Not Buying Soon,0.0,0.0,neutral
2023-08-17 00:00:00,AAPL,3 Top Semiconductor Stocks to Watch Right Now,0.39285714285714285,0.5178571428571428,positive
2023-08-17 00:00:00,AAPL,The 3 Most Undervalued Blue-Chip Stocks to Buy Now: August 2023,0.5,0.5,positive
2023-08-17 00:00:00,AAPL,"SPY, RUNN: Big ETF Inflows",0.0,0.1,neutral
2023-08-17 00:00:00,AAPL,Wedbush Reiterates Apple (AAPL) Outperform Recommendation,1.0,0.1,positive
2023-08-17 00:00:00,AAPL,"3 Stocks I Will ""Never"" Sell",0.0,0.0,neutral
2023-08-17 00:00:00,AAPL,Should Vanguard S&P 500 Growth ETF (VOOG) Be on Your Investing Radar?,1.0,0.1,positive
2023-08-17 00:00:00,AAPL,Apple Stock (NASDAQ:AAPL): Near-Term Headwinds Fuel Cautious Sentiment,1.0,0.1,positive
2023-08-17 00:00:00,AAPL,Guru Fundamental Report for AAPL - Warren Buffett,0.0,0.0,neutral
2023-08-17 00:00:00,AAPL,"Got $5,000? 3 Stocks to Hold for the Next 20 Years.",0.0,0.0,neutral
2023-08-17 00:00:00,AAPL,54.5% of Warren Buffett's $360 Billion Stock Portfolio Is in These 2 Blue Chip Stocks,0.0,0.1,neutral
2023-08-17 00:00:00,AAPL,Should Vanguard Mega Cap ETF (MGC) Be on Your Investing Radar?,0.0,0.0,neutral
2023-08-17 00:00:00,AAPL,2 Breakout Growth Stocks You Can Buy and Hold for the Next Decade,1.0,0.1,positive
2023-08-17 00:00:00,AAPL,3 Warren Buffett Stocks You Can Buy in August and Hold Forever,0.0,0.0,neutral
2023-08-16 00:00:00,AAPL,AAPL Factor-Based Stock Analysis - Warren Buffett,0.0,0.0,neutral
2023-08-16 00:00:00,AAPL,"Unusual Put Option Trade in Apple (AAPL) Worth $37,350.00K",0.25,0.55,positive
2023-08-16 00:00:00,AAPL,3 Beaten-Down Value Stocks You’ll Regret Not Buying During This Nasdaq Correction,1.0,0.1,positive
2023-08-16 00:00:00,AAPL,"Will Apple Acquire Disney? Probably Not, and Here's Why",0.0,0.0,neutral
2023-08-16 00:00:00,AAPL,7 Stocks to Buy as Back to School Spending Increases,0.0,0.0,neutral
2023-08-16 00:00:00,AAPL,3 Top Stocks Billionaires Are Loading Up On in 2023,0.5,0.5,positive
2023-08-16 00:00:00,AAPL,"Pre-Market Most Active for Aug 16, 2023 : AAPL, NIO, SQQQ, TQQQ, TSLA, TGT, TSEM, MRVL, C, AMC, WMT, COHR",0.18333333333333335,0.55,positive
2023-08-16 00:00:00,AAPL,Can Shiba Inu Reach $1?,0.0,0.0,neutral
2023-08-16 00:00:00,AAPL,More Reasons to Bite Into Apple (AAPL) Stock,0.5,0.5,positive
2023-08-16 00:00:00,AAPL,Want to Get Richer? 3 Best Stocks to Buy and Hold for the Next Decade,0.5,0.15,positive
2023-08-16 00:00:00,AAPL,These 3 Stocks Get High Grades for 2023 Back-to-School Shopping,1.0,0.1,positive
2023-08-16 00:00:00,AAPL,Is iShares Core Dividend Growth ETF (DGRO) a Strong ETF Right Now?,1.0,0.2,positive
2023-08-16 00:00:00,AAPL,2 Growth Stocks That Could Beat the Market Over the Next 10 Years,1.0,0.2,positive
2023-08-16 00:00:00,AAPL,Should Vanguard S&P 500 ETF (VOO) Be on Your Investing Radar?,0.0,0.0,neutral
2023-08-15 00:00:00,AAPL,Can the Rally in Amazon Continue?,1.0,0.1,positive
2023-08-15 00:00:00,AAPL,How Active ETF TMSL Limits Concentration Risk,-1.0,0.1,negative
2023-08-15 00:00:00,AAPL,3 Stocks to Own if Interest Rate Cuts Are on the Horizon,0.6,1.0,positive
2023-08-15 00:00:00,AAPL,"Technology Sector Update for 08/15/2023: JMIA, SE, WLDS, AAPL, RUM",0.0,0.0,neutral
2023-08-15 00:00:00,AAPL,David Tepper Goes Full Bull Mode: Top-Ranked Stocks He is Buying,0.35,0.55,positive
2023-08-15 00:00:00,AAPL,Should iShares Core S&P 500 ETF (IVV) Be on Your Investing Radar?,0.0,0.0,neutral
2023-08-15 00:00:00,AAPL,Should Fidelity Nasdaq Composite Index ETF (ONEQ) Be on Your Investing Radar?,0.0,0.0,neutral
2023-08-15 00:00:00,AAPL,Should SPDR S&P 500 ETF (SPY) Be on Your Investing Radar?,0.0,0.0,neutral
2023-08-15 00:00:00,AAPL,Should Vanguard Growth ETF (VUG) Be on Your Investing Radar?,1.0,0.1,positive
2023-08-15 00:00:00,AAPL,"Technology Sector Update for 08/15/2023: SE, WLDS, RUM, AAPL",0.0,0.0,neutral
2023-08-15 00:00:00,AAPL,Research on the Natural Interest Rate Suggests Stocks Will Soon Soar,1.0,0.1,positive
2023-08-15 00:00:00,AAPL,Is Apple Stock a Buy?,0.0,0.0,neutral
2023-08-15 00:00:00,AAPL,"With a Cash Pile of $118 Billion, Is Artificial Intelligence (AI) Stalwart Alphabet Poised to Start Paying a Dividend?",-0.6,1.0,negative
2023-08-15 00:00:00,AAPL,3 Mega-Cap Tech Stocks with More Than 20% Upside Potential,0.25,0.75,positive
2023-08-15 00:00:00,AAPL,US STOCKS-Futures drop as yields rise ahead of July retail sales data,0.0,0.2,neutral
2023-08-15 00:00:00,AAPL,AAPL Quantitative Stock Analysis - Warren Buffett,0.0,0.0,neutral
2023-08-15 00:00:00,AAPL,This Wall Street Strategist Predicted Apple's Ascent to $3 Trillion -- Now He Says 2 Artificial Intelligence (AI) Growth Stocks Will Win the Robotaxi Race,1.0,0.2,positive
2023-08-15 00:00:00,AAPL,DELL Australia Faces $6.5M Fine for False Monitor Pricing,0.008333333333333304,0.55,neutral
2023-08-15 00:00:00,AAPL,See Which Of The Latest 13F Filers Holds Apple,0.5,0.9,positive
2023-08-15 00:00:00,AAPL,US STOCKS-Futures slip as yields steady ahead of July retail sales data,0.16666666666666666,0.5,positive
2023-08-15 00:00:00,AAPL,2 Growth Stocks to Buy in August,1.0,0.1,positive
2023-08-15 00:00:00,AAPL,"Pre-Market Most Active for Aug 15, 2023 : TSHA, SQQQ, AAPL, AMD, TQQQ, SE, DASH, NVDA, AMC, NIO, APE, PLTR",0.18333333333333335,0.55,positive
2023-08-14 00:00:00,AAPL,"After Hours Most Active for Aug 14, 2023 : BMY, BAC, AAPL, GOOGL, MSFT, CSCO, INTC, GOOG, TFC, KMI, NU, WMT",0.18333333333333335,0.55,positive
2023-08-14 00:00:00,AAPL,Should You Buy the Dip in Apple Stock?,0.0,0.0,neutral
2023-08-14 00:00:00,AAPL,Netflix to make its games playable on more devices,0.5,0.5,positive
2023-08-14 00:00:00,AAPL,"Investors Look at Apple, Amazon, and More",0.5,0.5,positive
2023-08-14 00:00:00,AAPL,Investors pummeled by tech in 2022 make new bets on sector in second quarter,0.06818181818181818,0.22727272727272727,neutral
2023-08-14 00:00:00,AAPL,Ford taps Apple exec to build high-margin digital services,1.0,0.1,positive
2023-08-14 00:00:00,AAPL,Eye DTEC’s Equal-Weight Tech Approach,0.0,0.0,neutral
2023-08-14 00:00:00,AAPL,Enphase Energy Stock Just Reminded Investors of This Timeless Lesson,0.0,0.0,neutral
2023-08-14 00:00:00,AAPL,3 Dividend Aristocrats Ready to Outperform the S&P 500,1.0,0.1,positive
2023-08-14 00:00:00,AAPL,"Apple supplier Foxconn's Q2 profit slips 1%, better than forecasts",1.0,0.1,positive
2023-08-14 00:00:00,AAPL,Naver's 'Webtoon' CEO says barrier for new entrants is high,1.0,0.1,positive
2023-08-14 00:00:00,AAPL,Naver's 'Webtoon' CEO says barrier for new entrants is high,1.0,0.1,positive
2023-08-14 00:00:00,AAPL,Reasons to Still Believe In This New Bull Market,0.13636363636363635,0.45454545454545453,positive
2023-08-14 00:00:00,AAPL,US STOCKS-Futures rise as megacap growth stocks bounce; focus on economic data,1.0,0.2,positive
2023-08-14 00:00:00,AAPL,"Disney's future, a hot topic among Hollywood elite",0.125,0.48750000000000004,positive
2023-08-13 00:00:00,AAPL,Wall St Week Ahead-Sluggish US earnings may need pick-me-up to support 2023 stock rally,1.0,0.1,positive
2023-08-13 00:00:00,AAPL,"1 Magnificent Warren Buffett Stock That Turned $10,000 Into $68,000",1.0,1.0,positive
2023-08-13 00:00:00,AAPL,Guru Fundamental Report for AAPL - Warren Buffett,0.0,0.0,neutral
2023-08-13 00:00:00,AAPL,EXCLUSIVE-SoftBank in talks to buy Vision Fund's 25% stake in Arm -sources,0.0,0.0,neutral
2023-08-13 00:00:00,AAPL,EXCLUSIVE-SoftBank in talks to buy Vision Fund's 25% stake in Arm -sources,0.0,0.0,neutral
2023-08-13 00:00:00,AAPL,Invest Like Warren Buffett with These Stocks & ETFs,0.0,0.0,neutral
2023-08-12 00:00:00,AAPL,3 Metaverse Stocks You’ll Regret Not Buying Soon,0.0,0.0,neutral
2023-08-12 00:00:00,AAPL,1 Apple Chip Supplier Might Hold the Key to Understanding When iPhone Sales Rebound,0.0,1.0,neutral
2023-08-12 00:00:00,AAPL,3 Retailers To Watch Closely Next Week,0.0,0.0,neutral
2023-08-11 00:00:00,AAPL,US STOCKS-Wall St slides as growth stocks fall after producer prices data,0.0,0.2,neutral
2023-08-11 00:00:00,AAPL,"GQG Partners adds Nvidia, Amazon, Apple in Q2",0.0,0.0,neutral
2023-08-11 00:00:00,AAPL,Russian ministry bans employees from using iPhones for work - Ifax,0.0,0.0,neutral
2023-08-11 00:00:00,AAPL,Wall St Week Ahead-Sluggish US earnings may need pick-me-up to support 2023 stock rally,1.0,0.1,positive
2023-08-11 00:00:00,AAPL,"After Hours Most Active for Aug 11, 2023 : RIG, BAC, KMI, JNJ, KVUE, AMZN, NVST, QQQ, MSFT, REAL, AAPL, KHC",0.18888888888888888,0.46666666666666673,positive
2023-08-11 00:00:00,AAPL,How to Play the Pullback in Microsoft Stock,0.0,0.0,neutral
2023-08-11 00:00:00,AAPL,Why Innodata Stock Is Skyrocketing Today,0.0,0.0,neutral
2023-08-11 00:00:00,AAPL,"US STOCKS-S&P 500, Nasdaq fall as megacaps slide after producer prices data",-1.0,0.1,negative
2023-08-11 00:00:00,AAPL,What Will Alphabet do with its Cash Surplus?,0.0,0.0,neutral
2023-08-11 00:00:00,AAPL,Lessons for Investors from Q2 Earnings,0.0,0.0,neutral
2023-08-11 00:00:00,AAPL,US STOCKS-Wall St set for lower open after hotter-than-expected producer prices data,0.0,0.5,neutral
2023-08-11 00:00:00,AAPL,Warren Buffett Detailed Fundamental Analysis - AAPL,0.4,0.75,positive
2023-08-11 00:00:00,AAPL,Warren Buffett's Latest $1.3 Billion Buy Brings His Total Investment in This Stock to More Than $71 Billion in 5 Years,0.3333333333333333,0.7166666666666667,positive
2023-08-11 00:00:00,AAPL,"This Cheap Nasdaq Stock Could Double, and It Is a Screaming Buy Right Now",0.22857142857142856,0.41190476190476194,positive
2023-08-11 00:00:00,AAPL,Warren Buffett's Favorite Stock Just Did Something It Hasn't Done Since 2016,0.5,1.0,positive
2023-08-11 00:00:00,AAPL,Is WisdomTree U.S. Total Dividend ETF (DTD) a Strong ETF Right Now?,1.0,0.1,positive
2023-08-11 00:00:00,AAPL,Better Buy: Apple vs. Alphabet,0.5,0.5,positive
2023-08-11 00:00:00,AAPL,Apple (AAPL) Declares $0.24 Dividend,0.0,0.0,neutral
2023-08-11 00:00:00,AAPL,ETF Lessons to Learn from Berkshire Earnings,0.0,0.0,neutral
2023-08-11 00:00:00,AAPL,"Drinks, Chips & Drugs: A Surprising List of 10-Year Stock Winners",1.0,0.1,positive
2023-08-10 00:00:00,AAPL,Invest Like Warren Buffett with These Stocks & ETFs,0.0,0.0,neutral
2023-08-10 00:00:00,AAPL,"Caltech reaches 'potential settlement' in Apple, Broadcom patent case",0.0,1.0,neutral
2023-08-10 00:00:00,AAPL,5 Signs a Market Bounce May Be Imminent,0.0,0.0,neutral
2023-08-10 00:00:00,AAPL,July CPI Data: Bullish or Bearish for Stocks?,0.0,0.2,neutral
2023-08-10 00:00:00,AAPL,"Amazon scraps private label brands to cut costs, address antitrust scrutiny - source",0.0,0.375,neutral
2023-08-10 00:00:00,AAPL,US STOCKS-Wall St rises as July inflation data fuels Fed rate pause hopes,1.0,0.1,positive
2023-08-10 00:00:00,AAPL,"US STOCKS-Wall Street ends flat, gives up most gains after July inflation data",1.0,0.1,positive
2023-08-10 00:00:00,AAPL,Wall Street gives up gains as pop from July inflation data fizzles,1.0,0.1,positive
2023-08-10 00:00:00,AAPL,Soccer-Messi effect set to catapult Major League Soccer to 'new level',0.09943181818181818,0.4772727272727273,neutral
2023-08-10 00:00:00,AAPL,"Down 10% YTD, is Warren Buffett's Top Energy Stock Worth Buying?",0.2148148148148148,0.29629629629629634,positive
2023-08-10 00:00:00,AAPL,US STOCKS-Wall St rallies as July inflation data fuels Fed rate pause hopes,0.0,0.0,neutral
2023-08-10 00:00:00,AAPL,"After Hours Most Active for Aug 10, 2023 : JNJ, AMZN, KVUE, PFE, MSFT, BMY, PR, DIS, SABR, WBD, AAPL, QQQ",0.18333333333333335,0.55,positive
2023-08-10 00:00:00,AAPL,Should Vanguard Mega Cap Growth ETF (MGK) Be on Your Investing Radar?,1.0,0.1,positive
2023-08-10 00:00:00,AAPL,Avert Earnings Disaster With These 5 Methods,0.0,0.0,neutral
2023-08-10 00:00:00,AAPL,"1 ""Magnificent Seven"" Stock to Buy Hand Over Fist in August and 1 to Avoid Like the Plague",1.0,1.0,positive
2023-08-10 00:00:00,AAPL,US STOCKS-Wall St eyes higher open as July inflation data fuels Fed rate pause hopes,1.0,0.1,positive
2023-08-10 00:00:00,AAPL,Better Buy: PayPal or Block?,0.5,0.5,positive
2023-08-10 00:00:00,AAPL,Guru Fundamental Report for AAPL - Warren Buffett,0.0,0.0,neutral
2023-08-10 00:00:00,AAPL,Apple Stock: Buy the Dip?,0.0,0.0,neutral
2023-08-10 00:00:00,AAPL,Apple Inc. (AAPL) Is a Trending Stock: Facts to Know Before Betting on It,0.0,0.0,neutral
2023-08-10 00:00:00,AAPL,Should SPDR Portfolio S&P 500 ETF (SPLG) Be on Your Investing Radar?,0.0,0.0,neutral
2023-08-10 00:00:00,AAPL,Is John Hancock Multifactor Large Cap ETF (JHML) a Strong ETF Right Now?,1.0,0.1,positive
2023-08-10 00:00:00,AAPL,Should You Invest in the iShares Expanded Tech Sector ETF (IGM)?,0.0,0.0,neutral
2023-08-10 00:00:00,AAPL,US STOCKS-Futures rise in run-up to key inflation data,1.0,0.1,positive
2023-08-10 00:00:00,AAPL,"Stock Market News for Aug 10, 2023",0.0,0.0,neutral
2023-08-09 00:00:00,AAPL,US STOCKS-Wall Street falls ahead of CPI inflation data,-1.0,0.1,negative
2023-08-09 00:00:00,AAPL,US Supreme Court refuses Epic bid to let App Store order take effect in Apple case,0.1,0.4,neutral
2023-08-09 00:00:00,AAPL,US Supreme Court refuses Epic bid to let App Store order take effect in Apple case,0.1,0.4,neutral
2023-08-09 00:00:00,AAPL,US STOCKS-Wall Street drops ahead of CPI inflation data,-1.0,0.1,negative
2023-08-09 00:00:00,AAPL,US STOCKS-Wall Street closes lower as investors wait for inflation data,0.0,0.0,neutral
2023-08-09 00:00:00,AAPL,3 Not-So-Obvious Stocks to Benefit From Biden’s Broadband Plan,0.0,0.0,neutral
